-- phpMyAdmin SQL Dump
-- version 5.2.2
-- https://www.phpmyadmin.net/
--
-- Hôte : 127.0.0.1:3306
-- Généré le : ven. 28 nov. 2025 à 16:32
-- Version du serveur : 11.8.3-MariaDB-log
-- Version de PHP : 7.2.34

SET SQL_MODE = "NO_AUTO_VALUE_ON_ZERO";
START TRANSACTION;
SET time_zone = "+00:00";


/*!40101 SET @OLD_CHARACTER_SET_CLIENT=@@CHARACTER_SET_CLIENT */;
/*!40101 SET @OLD_CHARACTER_SET_RESULTS=@@CHARACTER_SET_RESULTS */;
/*!40101 SET @OLD_COLLATION_CONNECTION=@@COLLATION_CONNECTION */;
/*!40101 SET NAMES utf8mb4 */;

--
-- Base de données : `u700697006_solergy`
--

-- --------------------------------------------------------

--
-- Structure de la table `achats`
--

CREATE TABLE `achats` (
  `id` bigint(20) UNSIGNED NOT NULL,
  `date` varchar(255) NOT NULL,
  `statut` varchar(255) DEFAULT NULL,
  `montantVerse` varchar(255) DEFAULT NULL,
  `qte` varchar(255) DEFAULT NULL,
  `total` int(11) NOT NULL,
  `updated_by` varchar(255) DEFAULT NULL,
  `impot` varchar(255) DEFAULT NULL,
  `compte_id` bigint(20) UNSIGNED DEFAULT NULL,
  `user_id` bigint(20) UNSIGNED DEFAULT NULL,
  `created_at` timestamp NULL DEFAULT NULL,
  `updated_at` timestamp NULL DEFAULT NULL
) ENGINE=InnoDB DEFAULT CHARSET=utf8mb4 COLLATE=utf8mb4_unicode_ci;

--
-- Déchargement des données de la table `achats`
--

INSERT INTO `achats` (`id`, `date`, `statut`, `montantVerse`, `qte`, `total`, `updated_by`, `impot`, `compte_id`, `user_id`, `created_at`, `updated_at`) VALUES
(1, '05-11-2024', 'non termine', '253000', '7', 508000, NULL, NULL, 6, 9, '2024-11-05 16:01:39', '2024-11-05 16:01:39'),
(2, '05-11-2024', 'non termine', '5000', '1', 20000, NULL, NULL, 6, 9, '2024-11-05 16:09:25', '2024-11-05 16:09:25'),
(3, '07-11-2024', 'non termine', '3500', '1', 3500, NULL, NULL, 6, 8, '2024-11-07 11:28:45', '2024-11-07 11:28:45'),
(4, '20-11-2024', 'non termine', '5000', '1', 5000, NULL, 'on', 6, 9, '2024-11-20 16:17:12', '2024-11-20 16:17:12'),
(5, '12-12-2024', 'non termine', '243503', '2', 243503, NULL, NULL, 6, 8, '2024-12-12 17:15:01', '2024-12-12 17:15:01'),
(6, '30-12-2024', 'termine', '197000', '2', 197000, NULL, NULL, 6, 8, '2024-12-30 11:59:03', '2024-12-30 11:59:03'),
(7, '30-12-2024', 'termine', '0', '1', 0, NULL, NULL, 6, 2, '2024-12-30 18:06:36', '2024-12-30 18:06:36'),
(8, '30-12-2024', 'termine', '9000', '1', 9000, NULL, NULL, 6, 8, '2024-12-30 18:07:56', '2024-12-30 18:07:56'),
(9, '30-12-2024', 'termine', '30000', '1', 30000, NULL, NULL, 10, 8, '2024-12-30 18:12:00', '2024-12-30 18:12:00'),
(10, '30-12-2024', 'termine', '165000', '3', 165000, NULL, NULL, 10, 8, '2024-12-30 18:36:05', '2024-12-30 18:36:05'),
(11, '30-12-2024', 'termine', '45000', '1', 45000, NULL, NULL, 10, 8, '2024-12-30 18:39:00', '2024-12-30 18:39:00'),
(12, '18-01-2025', 'termine', '12500', '1', 12500, NULL, NULL, 6, 9, '2025-01-18 14:14:46', '2025-01-18 14:14:46'),
(13, '21-01-2025', 'non termine', '220000', '1', 224000, NULL, 'on', 6, 9, '2025-01-21 09:09:45', '2025-01-21 09:09:45'),
(14, '21-01-2025', 'termine', '216000', '1', 216000, NULL, NULL, 6, 8, '2025-01-21 17:23:37', '2025-01-21 17:23:37'),
(15, '28-01-2025', 'termine', '90000', '1', 90000, NULL, 'on', 6, 9, '2025-01-28 15:33:31', '2025-01-28 15:33:31'),
(16, '28-01-2025', 'termine', '220000', '1', 220000, NULL, 'on', 6, 9, '2025-01-28 15:36:29', '2025-01-28 15:36:29'),
(17, '04-02-2025', 'termine', '242000', '2', 242000, NULL, 'on', 6, 9, '2025-02-04 10:59:58', '2025-02-04 10:59:58'),
(18, '10-02-2025', 'termine', '32000', '1', 28000, NULL, 'on', 6, 9, '2025-02-10 10:01:03', '2025-02-10 10:01:03'),
(19, '17-02-2025', 'termine', '252500', '7', 252500, NULL, NULL, 6, 8, '2025-02-17 13:06:26', '2025-02-17 13:06:26'),
(20, '20-02-2025', 'non termine', '869000', '4', 969000, NULL, NULL, 6, 8, '2025-02-20 05:40:53', '2025-02-20 05:40:53'),
(21, '26-02-2025', 'termine', '70000', '1', 60000, NULL, 'on', 6, 9, '2025-02-26 16:11:50', '2025-02-26 16:11:50'),
(22, '26-02-2025', 'non termine', '9000', '1', 15000, NULL, 'on', 6, 9, '2025-02-26 16:13:16', '2025-02-26 16:13:16'),
(23, '01-03-2025', 'termine', '37900', '5', 37900, NULL, 'on', 6, 9, '2025-03-01 14:43:53', '2025-03-01 14:43:53'),
(24, '01-03-2025', 'termine', '2000', '1', 2000, NULL, 'on', 6, 9, '2025-03-01 15:11:16', '2025-03-01 15:11:16'),
(25, '03-03-2025', 'termine', '4000', '1', 4000, NULL, 'on', 6, 9, '2025-03-03 09:23:17', '2025-03-03 09:23:17'),
(26, '04-03-2025', 'termine', '38000', '1', 38000, NULL, 'on', 6, 9, '2025-03-04 16:06:24', '2025-03-04 16:06:24'),
(27, '05-03-2025', 'non termine', '81000', '2', 95000, NULL, 'on', 6, 9, '2025-03-05 09:29:54', '2025-03-05 09:29:54'),
(28, '18-03-2025', 'non termine', '4000', '1', 6000, NULL, 'on', 6, 9, '2025-03-18 16:56:20', '2025-03-18 16:56:20'),
(29, '18-03-2025', 'termine', '13000', '1', 10000, NULL, 'on', 6, 9, '2025-03-18 16:57:26', '2025-03-18 16:57:26'),
(30, '22-03-2025', 'termine', '140000', '5', 140000, NULL, 'on', 6, 9, '2025-03-22 17:27:37', '2025-03-22 17:27:37'),
(31, '01-04-2025', 'termine', '50000', '4', 50000, NULL, 'on', 6, 9, '2025-04-01 18:44:12', '2025-04-01 18:44:12'),
(32, '17-04-2025', 'termine', '15000', '1', 15000, NULL, 'on', 10, 9, '2025-04-17 17:09:54', '2025-04-17 17:09:54'),
(33, '21-04-2025', 'termine', '21800', '4', 21800, NULL, 'on', 10, 9, '2025-04-21 09:42:21', '2025-04-21 09:42:21'),
(34, '28-04-2025', 'termine', '84000', '1', 84000, NULL, 'on', 10, 9, '2025-04-28 14:57:13', '2025-04-28 14:57:13'),
(35, '07-05-2025', 'termine', '256000', '2', 256000, NULL, 'on', 10, 9, '2025-05-07 13:11:02', '2025-05-07 13:11:02'),
(36, '07-05-2025', 'termine', '268000', '2', 268000, NULL, 'on', 10, 9, '2025-05-07 13:34:07', '2025-05-07 13:34:07'),
(37, '09-05-2025', 'termine', '71923', '5', 69100, NULL, NULL, 6, 8, '2025-05-09 11:41:49', '2025-05-09 11:41:49'),
(38, '17-05-2025', 'termine', '173000', '3', 173000, NULL, 'on', 10, 9, '2025-05-17 16:06:16', '2025-05-17 16:06:16'),
(39, '17-05-2025', 'termine', '6900', '2', 6900, NULL, 'on', 10, 9, '2025-05-17 16:33:20', '2025-05-17 16:33:20'),
(40, '19-05-2025', 'termine', '173000', '2', 173000, NULL, 'on', 10, 9, '2025-05-19 11:56:36', '2025-05-19 11:56:36'),
(41, '19-05-2025', 'termine', '125000', '1', 125000, NULL, 'on', 10, 9, '2025-05-19 12:40:02', '2025-05-19 12:40:02'),
(42, '21-05-2025', 'termine', '385000', '3', 385000, NULL, 'on', 6, 9, '2025-05-21 18:24:02', '2025-05-21 18:24:02'),
(43, '26-05-2025', 'termine', '310000', '2', 310000, NULL, 'on', 6, 9, '2025-05-26 18:40:34', '2025-05-26 18:40:34'),
(44, '30-05-2025', 'termine', '647000', '6', 647000, NULL, 'on', 6, 9, '2025-05-30 17:38:53', '2025-05-30 17:38:53'),
(45, '02-06-2025', 'termine', '102000', '1', 100000, NULL, 'on', 6, 9, '2025-06-02 15:23:21', '2025-06-02 15:23:21'),
(46, '17-06-2025', 'termine', '100000', '1', 100000, NULL, NULL, 6, 9, '2025-06-17 17:08:40', '2025-06-17 17:08:40'),
(47, '24-06-2025', 'termine', '130000', '1', 130000, NULL, NULL, 6, 9, '2025-06-24 15:37:48', '2025-06-24 15:37:48'),
(48, '26-06-2025', 'termine', '198500', '4', 198500, NULL, NULL, 6, 9, '2025-06-26 15:13:19', '2025-06-26 15:13:19'),
(49, '01-07-2025', 'termine', '293000', '6', 293000, NULL, NULL, 6, 9, '2025-07-01 10:05:51', '2025-07-01 10:05:51'),
(50, '09-07-2025', 'termine', '590000', '2', 590000, NULL, NULL, 6, 9, '2025-07-09 15:29:11', '2025-07-09 15:29:11'),
(51, '11-07-2025', 'termine', '80000', '1', 80000, NULL, NULL, 6, 9, '2025-07-11 08:44:42', '2025-07-11 08:44:42'),
(52, '11-07-2025', 'termine', '10000', '1', 10000, NULL, NULL, 6, 9, '2025-07-11 08:49:56', '2025-07-11 08:49:56'),
(53, '11-07-2025', 'non termine', '5000', '1', 6000, NULL, NULL, 6, 9, '2025-07-11 08:51:18', '2025-07-11 08:51:18'),
(54, '14-07-2025', 'termine', '8000', '1', 8000, NULL, NULL, 6, 9, '2025-07-14 18:05:35', '2025-07-14 18:05:35'),
(55, '18-07-2025', 'termine', '294000', '4', 294000, NULL, NULL, 6, 9, '2025-07-18 11:05:57', '2025-07-18 11:05:57'),
(56, '18-07-2025', 'termine', '8000', '1', 8000, NULL, NULL, 6, 9, '2025-07-18 11:14:30', '2025-07-18 11:14:30'),
(57, '19-07-2025', 'termine', '200000', '2', 200000, NULL, NULL, 6, 9, '2025-07-19 10:46:44', '2025-07-19 10:46:44'),
(58, '19-07-2025', 'termine', '258000', '2', 258000, NULL, NULL, 6, 9, '2025-07-19 19:11:41', '2025-07-19 19:11:41'),
(59, '21-07-2025', 'termine', '159200', '2', 159200, NULL, NULL, 6, 9, '2025-07-21 16:47:16', '2025-07-21 16:47:16'),
(60, '22-07-2025', 'termine', '449000', '5', 449000, NULL, NULL, 6, 9, '2025-07-22 14:57:29', '2025-07-22 14:57:29'),
(61, '30-07-2025', 'termine', '180000', '1', 180000, NULL, NULL, 6, 9, '2025-07-30 12:49:13', '2025-07-30 12:49:13'),
(62, '30-07-2025', 'termine', '180000', '1', 180000, NULL, NULL, 6, 9, '2025-07-30 12:57:15', '2025-07-30 12:57:15'),
(63, '07-08-2025', 'termine', '165000', '1', 165000, NULL, NULL, 6, 9, '2025-08-07 15:40:28', '2025-08-07 15:40:28'),
(64, '07-08-2025', 'termine', '30000', '2', 30000, NULL, NULL, 6, 9, '2025-08-07 16:13:28', '2025-08-07 16:13:28'),
(65, '11-08-2025', 'termine', '208000', '2', 208000, NULL, NULL, 6, 9, '2025-08-11 16:08:52', '2025-08-11 16:08:52'),
(66, '12-08-2025', 'non termine', '46000', '2', 48000, NULL, NULL, 6, 9, '2025-08-12 09:24:58', '2025-08-12 09:24:58'),
(67, '20-08-2025', 'termine', '59000', '6', 59000, NULL, NULL, 6, 8, '2025-08-20 18:57:28', '2025-08-20 18:57:28'),
(68, '10-09-2025', 'termine', '30000', '1', 30000, NULL, NULL, 10, 9, '2025-09-10 13:51:20', '2025-09-10 13:51:20'),
(69, '30-09-2025', 'termine', '121000', '4', 121000, NULL, NULL, 13, 9, '2025-09-30 10:06:53', '2025-09-30 10:06:53'),
(70, '01-10-2025', 'termine', '80000', '1', 80000, NULL, NULL, 13, 9, '2025-10-01 13:36:23', '2025-10-01 13:36:23'),
(71, '08-10-2025', 'termine', '202000', '3', 202000, NULL, NULL, 13, 9, '2025-10-08 13:00:28', '2025-10-08 13:00:28'),
(72, '08-10-2025', 'termine', '20000', '1', 20000, NULL, NULL, 10, 9, '2025-10-08 13:17:10', '2025-10-08 13:17:10'),
(73, '17-11-2025', 'termine', '45000', '1', 45000, NULL, NULL, 16, 9, '2025-11-17 18:02:36', '2025-11-17 18:02:36'),
(74, '17-11-2025', 'termine', '67000', '1', 67000, NULL, NULL, 16, 9, '2025-11-17 18:07:41', '2025-11-17 18:07:41'),
(75, '25-11-2025', 'termine', '279350', '2', 279350, NULL, NULL, 10, 9, '2025-11-25 10:03:26', '2025-11-25 10:03:26');

-- --------------------------------------------------------

--
-- Structure de la table `achat_paiements`
--

CREATE TABLE `achat_paiements` (
  `id` bigint(20) UNSIGNED NOT NULL,
  `achat_id` bigint(20) UNSIGNED NOT NULL,
  `compte_id` bigint(20) UNSIGNED NOT NULL,
  `montant` varchar(255) NOT NULL,
  `user_id` bigint(20) UNSIGNED NOT NULL,
  `created_at` timestamp NULL DEFAULT NULL,
  `updated_at` timestamp NULL DEFAULT NULL
) ENGINE=InnoDB DEFAULT CHARSET=utf8mb4 COLLATE=utf8mb4_unicode_ci;

-- --------------------------------------------------------

--
-- Structure de la table `agents`
--

CREATE TABLE `agents` (
  `id` bigint(20) UNSIGNED NOT NULL,
  `name` varchar(255) NOT NULL,
  `numero` varchar(255) NOT NULL,
  `created_at` timestamp NULL DEFAULT NULL,
  `updated_at` timestamp NULL DEFAULT NULL
) ENGINE=InnoDB DEFAULT CHARSET=utf8mb4 COLLATE=utf8mb4_unicode_ci;

-- --------------------------------------------------------

--
-- Structure de la table `annonces`
--

CREATE TABLE `annonces` (
  `id` bigint(20) UNSIGNED NOT NULL,
  `image` varchar(255) DEFAULT NULL,
  `produit_id` bigint(20) UNSIGNED DEFAULT NULL,
  `status` varchar(255) DEFAULT NULL,
  `service_id` bigint(20) UNSIGNED DEFAULT NULL,
  `created_at` timestamp NULL DEFAULT NULL,
  `updated_at` timestamp NULL DEFAULT NULL
) ENGINE=InnoDB DEFAULT CHARSET=utf8mb4 COLLATE=utf8mb4_unicode_ci;

--
-- Déchargement des données de la table `annonces`
--

INSERT INTO `annonces` (`id`, `image`, `produit_id`, `status`, `service_id`, `created_at`, `updated_at`) VALUES
(9, '1839550894565875.MCCB 250A.jpg', 260, 'desactiver', NULL, '2025-08-04 19:34:01', '2025-11-16 15:47:33');

-- --------------------------------------------------------

--
-- Structure de la table `appareil_simulations`
--

CREATE TABLE `appareil_simulations` (
  `id` bigint(20) UNSIGNED NOT NULL,
  `name` varchar(255) NOT NULL,
  `quantity` varchar(255) NOT NULL,
  `power` varchar(255) NOT NULL,
  `duration` varchar(255) NOT NULL,
  `simulation_id` bigint(20) UNSIGNED NOT NULL,
  `created_at` timestamp NULL DEFAULT NULL,
  `updated_at` timestamp NULL DEFAULT NULL
) ENGINE=InnoDB DEFAULT CHARSET=utf8mb4 COLLATE=utf8mb4_unicode_ci;

--
-- Déchargement des données de la table `appareil_simulations`
--

INSERT INTO `appareil_simulations` (`id`, `name`, `quantity`, `power`, `duration`, `simulation_id`, `created_at`, `updated_at`) VALUES
(1, 'tv', '1', '50', '9', 1, '2025-05-04 10:52:34', '2025-05-04 10:52:34'),
(2, 'ampoules', '8', '9', '5', 1, '2025-05-04 10:52:34', '2025-05-04 10:52:34'),
(3, 'tv', '2', '50', '9', 2, '2025-05-05 10:35:59', '2025-05-05 10:35:59'),
(4, 'frigo', '1', '120', '20', 2, '2025-05-05 10:35:59', '2025-05-05 10:35:59'),
(5, 'decodeur', '1', '15', '9', 2, '2025-05-05 10:35:59', '2025-05-05 10:35:59'),
(6, 'TV', '1', '19', '9', 3, '2025-05-05 16:36:19', '2025-05-05 16:36:19'),
(7, 'REGLETTES SOLAIRE', '5', '4', '5', 3, '2025-05-05 16:36:19', '2025-05-05 16:36:19'),
(8, 'PHONE', '1', '15', '1', 3, '2025-05-05 16:36:19', '2025-05-05 16:36:19'),
(9, 'TV', '1', '48', '9', 4, '2025-05-05 18:49:51', '2025-05-05 18:49:51'),
(10, 'REGLETTES', '3', '4', '6', 4, '2025-05-05 18:49:51', '2025-05-05 18:49:51'),
(11, 'TELEPHONE', '5', '15', '2', 4, '2025-05-05 18:49:51', '2025-05-05 18:49:51'),
(12, 'MOYENNE', '1', '4300', '10', 5, '2025-05-09 13:17:10', '2025-05-09 13:17:10'),
(13, 'pompe ', '1', '750', '17', 6, '2025-05-12 10:11:16', '2025-05-12 10:11:16'),
(14, 'climatiseurs ', '10', '2500', '8', 7, '2025-05-13 12:38:19', '2025-05-13 12:38:19'),
(15, 'FRIGOS', '15', '110', '15', 7, '2025-05-13 12:38:19', '2025-05-13 12:38:19'),
(16, 'FOURS ', '7', '2000', '4', 7, '2025-05-13 12:38:19', '2025-05-13 12:38:19'),
(17, 'LAVEUSES', '5', '1500', '3', 7, '2025-05-13 12:38:19', '2025-05-13 12:38:19'),
(18, 'VENTILATEURS', '20', '70', '5', 7, '2025-05-13 12:38:19', '2025-05-13 12:38:19'),
(19, 'TELE', '16', '80', '8', 7, '2025-05-13 12:38:19', '2025-05-13 12:38:19'),
(20, 'décodeur', '16', '15', '8', 7, '2025-05-13 12:38:19', '2025-05-13 12:38:19'),
(21, 'AMPOULES ', '80', '10', '6', 7, '2025-05-13 12:38:19', '2025-05-13 12:38:19'),
(22, 'Réglette 1', '4', '4', '11', 8, '2025-05-14 10:57:24', '2025-05-14 10:57:24'),
(23, 'Réglette 2', '2', '9', '11', 8, '2025-05-14 10:57:24', '2025-05-14 10:57:24'),
(24, 'Ventilateur ', '2', '15', '11', 8, '2025-05-14 10:57:24', '2025-05-14 10:57:24'),
(25, 'Tv', '1', '45', '11', 8, '2025-05-14 10:57:24', '2025-05-14 10:57:24'),
(26, 'Caméra ', '1', '60', '11', 8, '2025-05-14 10:57:24', '2025-05-14 10:57:24'),
(27, 'Climatiseur ', '1', '1070', '5', 8, '2025-05-14 10:57:24', '2025-05-14 10:57:24'),
(28, 'Spot ', '6', '4', '11', 8, '2025-05-14 10:57:24', '2025-05-14 10:57:24'),
(29, 'L\'imprimante ', '1', '60', '11', 8, '2025-05-14 10:57:24', '2025-05-14 10:57:24'),
(30, 'Laptop ', '3', '70', '11', 8, '2025-05-14 10:57:24', '2025-05-14 10:57:24'),
(31, 'Micro-ondes ', '1', '1030', '1', 9, '2025-05-15 06:49:10', '2025-05-15 06:49:10'),
(32, 'Lave vaisselle ', '1', '1800', '2', 9, '2025-05-15 06:49:10', '2025-05-15 06:49:10'),
(33, 'Cuisinière électrique ', '1', '2000', '2', 9, '2025-05-15 06:49:10', '2025-05-15 06:49:10'),
(34, 'Réfrigérateur ', '2', '130', '18', 9, '2025-05-15 06:49:10', '2025-05-15 06:49:10'),
(35, 'Écran 1', '1', '111', '9', 9, '2025-05-15 06:49:10', '2025-05-15 06:49:10'),
(36, 'Lampe ', '40', '18', '8', 9, '2025-05-15 06:49:10', '2025-05-15 06:49:10'),
(37, 'Écran 2', '1', '115', '9', 9, '2025-05-15 06:49:10', '2025-05-15 06:49:10'),
(38, 'Mini frigo ', '1', '40', '8', 9, '2025-05-15 06:49:10', '2025-05-15 06:49:10'),
(39, 'Lave linge ', '1', '7000', '2.5', 9, '2025-05-15 06:49:10', '2025-05-15 06:49:10'),
(40, 'Chauffe eau ', '1', '1200', '2', 9, '2025-05-15 06:49:10', '2025-05-15 06:49:10'),
(41, 'Écran 3', '1', '80', '7', 9, '2025-05-15 06:49:10', '2025-05-15 06:49:10'),
(42, 'Sur presseur ', '1', '1200', '6', 9, '2025-05-15 06:49:10', '2025-05-15 06:49:10'),
(43, 'Frigo ', '1', '280', '8', 10, '2025-05-16 16:32:34', '2025-05-16 16:32:34'),
(44, 'Frigo ', '1', '180', '6', 10, '2025-05-16 16:32:34', '2025-05-16 16:32:34'),
(45, 'Ecrant ', '1', '111', '8', 10, '2025-05-16 16:32:34', '2025-05-16 16:32:34'),
(46, 'Lampe', '40', '18', '6', 10, '2025-05-16 16:32:34', '2025-05-16 16:32:34'),
(47, 'Écrant', '1', '115', '5', 10, '2025-05-16 16:32:34', '2025-05-16 16:32:34'),
(48, 'Frigo ', '1', '60', '5', 10, '2025-05-16 16:32:34', '2025-05-16 16:32:34'),
(49, 'Lave linge', '1', '2100', '1', 10, '2025-05-16 16:32:34', '2025-05-16 16:32:34'),
(50, 'Écran ', '1', '80', '5', 10, '2025-05-16 16:32:34', '2025-05-16 16:32:34'),
(51, 'Lave-linge/ ¥onde/lave-vaisselle (1au choix par jour) ', '1', '2100', '1', 11, '2025-05-17 12:01:37', '2025-05-17 12:01:37'),
(52, 'Frigo 1', '1', '280', '10', 11, '2025-05-17 12:01:37', '2025-05-17 12:01:37'),
(53, 'Frigo 2', '1', '180', '8', 11, '2025-05-17 12:01:37', '2025-05-17 12:01:37'),
(54, 'Frigo 3', '1', '40', '5', 11, '2025-05-17 12:01:37', '2025-05-17 12:01:37'),
(55, 'Écran 1', '1', '111', '8', 11, '2025-05-17 12:01:37', '2025-05-17 12:01:37'),
(56, 'Écran 2', '1', '115', '6', 11, '2025-05-17 12:01:37', '2025-05-17 12:01:37'),
(57, 'Écran 3', '1', '80', '6', 11, '2025-05-17 12:01:37', '2025-05-17 12:01:37'),
(58, 'Éclairage ', '40', '12', '6', 11, '2025-05-17 12:01:37', '2025-05-17 12:01:37'),
(59, 'Sur presseur ', '1', '1200', '2', 11, '2025-05-17 12:01:37', '2025-05-17 12:01:37'),
(60, 'TELE1', '2', '50', '8', 12, '2025-05-17 14:23:23', '2025-05-17 14:23:23'),
(61, 'TELE1', '1', '50', '8', 12, '2025-05-17 14:23:23', '2025-05-17 14:23:23'),
(62, 'FRIGO', '4', '110', '15', 12, '2025-05-17 14:23:23', '2025-05-17 14:23:23'),
(63, 'machine a laver ', '1', '2100', '1', 12, '2025-05-17 14:23:23', '2025-05-17 14:23:23'),
(64, 'AMPOULES', '20', '10', '6', 12, '2025-05-17 14:23:23', '2025-05-17 14:23:23'),
(65, 'VENTILATEURS ', '5', '55', '5', 12, '2025-05-17 14:23:23', '2025-05-17 14:23:23'),
(66, 'MOULINEX', '1', '1000', '1', 12, '2025-05-17 14:23:23', '2025-05-17 14:23:23'),
(67, 'fer a repasser ', '1', '1000', '1', 12, '2025-05-17 14:23:23', '2025-05-17 14:23:23'),
(68, 'FRIGO', '1', '110', '15', 13, '2025-05-17 16:41:27', '2025-05-17 16:41:27'),
(69, 'TELEVISION ', '1', '80', '8', 13, '2025-05-17 16:41:27', '2025-05-17 16:41:27'),
(70, 'AMPOULE', '4', '10', '6', 13, '2025-05-17 16:41:27', '2025-05-17 16:41:27'),
(71, 'AMPOULES', '8', '12', '5', 14, '2025-05-21 08:42:23', '2025-05-21 08:42:23'),
(72, 'FRIDGE', '1', '120', '4', 14, '2025-05-21 08:42:23', '2025-05-21 08:42:23'),
(73, 'TV', '1', '90', '5', 14, '2025-05-21 08:42:23', '2025-05-21 08:42:23'),
(74, 'STARLINK', '1', '90', '5', 14, '2025-05-21 08:42:23', '2025-05-21 08:42:23'),
(75, 'bulbs', '13', '12', '8', 15, '2025-05-21 13:32:51', '2025-05-21 13:32:51'),
(76, 'TV', '14', '60', '10', 15, '2025-05-21 13:32:51', '2025-05-21 13:32:51'),
(77, 'FRIDGE', '1', '110', '18', 15, '2025-05-21 13:32:51', '2025-05-21 13:32:51'),
(78, 'Bulbs', '13', '12', '7', 16, '2025-05-21 13:33:33', '2025-05-21 13:33:33'),
(79, 'Tv', '14', '60', '10', 16, '2025-05-21 13:33:33', '2025-05-21 13:33:33'),
(80, 'Frigo ', '1', '110', '15', 16, '2025-05-21 13:33:33', '2025-05-21 13:33:33'),
(81, 'Bulbs', '13', '12', '7', 17, '2025-05-21 13:34:12', '2025-05-21 13:34:12'),
(82, 'Tv', '14', '60', '10', 17, '2025-05-21 13:34:12', '2025-05-21 13:34:12'),
(83, 'Frigo ', '1', '110', '15', 17, '2025-05-21 13:34:12', '2025-05-21 13:34:12'),
(84, 'Réglette pt', '4', '4', '11', 18, '2025-05-22 13:45:57', '2025-05-22 13:45:57'),
(85, 'Réglette gd', '2', '9', '11', 18, '2025-05-22 13:45:57', '2025-05-22 13:45:57'),
(86, 'Ventilateur 1', '1', '15', '11', 18, '2025-05-22 13:45:57', '2025-05-22 13:45:57'),
(87, 'Ventilateur 2', '1', '15', '5', 18, '2025-05-22 13:45:57', '2025-05-22 13:45:57'),
(88, 'Tv', '1', '45', '5', 18, '2025-05-22 13:45:57', '2025-05-22 13:45:57'),
(89, 'Caméra ', '1', '60', '11', 18, '2025-05-22 13:45:57', '2025-05-22 13:45:57'),
(90, 'Climatiseur ', '1', '1070', '5', 18, '2025-05-22 13:45:57', '2025-05-22 13:45:57'),
(91, 'Spots', '6', '4', '11', 18, '2025-05-22 13:45:57', '2025-05-22 13:45:57'),
(92, 'L\'imprimante ', '1', '60', '6', 18, '2025-05-22 13:45:57', '2025-05-22 13:45:57'),
(93, 'Laptops ', '3', '70', '11', 18, '2025-05-22 13:45:57', '2025-05-22 13:45:57'),
(94, 'Tv', '2', '90', '9', 19, '2025-06-01 11:07:01', '2025-06-01 11:07:01'),
(95, 'Congélateur ', '1', '120', '17', 19, '2025-06-01 11:07:01', '2025-06-01 11:07:01'),
(96, 'Woofer', '1', '60', '5', 19, '2025-06-01 11:07:01', '2025-06-01 11:07:01'),
(97, 'Ampoules ', '40', '20', '6.5', 19, '2025-06-01 11:07:01', '2025-06-01 11:07:01'),
(98, 'climatiseur1', '1', '1500', '15', 20, '2025-06-02 10:21:55', '2025-06-02 10:21:55'),
(99, 'CLIMATISEUR2', '1', '2000', '15', 20, '2025-06-02 10:21:55', '2025-06-02 10:21:55'),
(100, 'AMPOULES ', '15', '10', '6', 20, '2025-06-02 10:21:55', '2025-06-02 10:21:55'),
(101, 'FAN', '3', '55', '5', 21, '2025-06-02 16:42:01', '2025-06-02 16:42:01'),
(102, 'BULBS', '8', '9', '5', 21, '2025-06-02 16:42:01', '2025-06-02 16:42:01'),
(103, 'FREEZER', '1', '110', '3', 21, '2025-06-02 16:42:01', '2025-06-02 16:42:01'),
(104, 'TELE ', '1', '80', '8', 22, '2025-06-04 14:41:18', '2025-06-04 14:41:18'),
(105, 'AMPOULES ', '15', '10', '6', 22, '2025-06-04 14:41:18', '2025-06-04 14:41:18'),
(106, 'FER A REPASSER ', '1', '1200', '1', 22, '2025-06-04 14:41:18', '2025-06-04 14:41:18'),
(107, 'CHAUFFE EAU', '1', '1200', '1', 22, '2025-06-04 14:41:18', '2025-06-04 14:41:18'),
(108, 'VENTILATEUR ', '1', '55', '5', 22, '2025-06-04 14:41:18', '2025-06-04 14:41:18'),
(109, 'AIR FRYER ', '1', '1200', '2', 22, '2025-06-04 14:41:18', '2025-06-04 14:41:18'),
(110, 'Téléviseurs ', '1', '50', '10', 23, '2025-06-26 16:46:41', '2025-06-26 16:46:41'),
(111, 'Ampoule ', '10', '12', '6', 23, '2025-06-26 16:46:41', '2025-06-26 16:46:41'),
(112, 'Fer à repasser ', '1', '1500', '0.5', 23, '2025-06-26 16:46:41', '2025-06-26 16:46:41'),
(113, 'Radio ', '1', '15', '3', 23, '2025-06-26 16:46:41', '2025-06-26 16:46:41'),
(114, 'Frigo ', '1', '130', '16', 23, '2025-06-26 16:46:41', '2025-06-26 16:46:41'),
(115, 'TELVISION ', '1', '50', '8', 24, '2025-07-02 10:56:46', '2025-07-02 10:56:46'),
(116, 'DECODEUR ', '1', '15', '8', 24, '2025-07-02 10:56:46', '2025-07-02 10:56:46'),
(117, 'AMPOULES', '6', '10', '6', 24, '2025-07-02 10:56:46', '2025-07-02 10:56:46'),
(118, 'VENTILATEUR', '2', '55', '5', 24, '2025-07-02 10:56:46', '2025-07-02 10:56:46'),
(119, 'FRIGO', '1', '110', '18', 24, '2025-07-02 10:56:46', '2025-07-02 10:56:46'),
(120, 'machine a glace ', '1', '1800', '12', 25, '2025-07-04 10:09:16', '2025-07-04 10:09:16'),
(121, 'AMPULES ', '56', '9', '6', 26, '2025-07-18 15:39:34', '2025-07-18 15:39:34'),
(122, 'TELEVISEUR ', '4', '50', '8', 26, '2025-07-18 15:39:34', '2025-07-18 15:39:34'),
(123, 'CONGELATEUR', '2', '110', '18', 26, '2025-07-18 15:39:34', '2025-07-18 15:39:34'),
(124, 'IMPRIMANTE', '1', '1800', '4', 26, '2025-07-18 15:39:34', '2025-07-18 15:39:34'),
(125, 'APOULES ', '10', '10', '6', 27, '2025-07-21 14:31:12', '2025-07-21 14:31:12'),
(126, 'TV', '1', '80', '8', 27, '2025-07-21 14:31:12', '2025-07-21 14:31:12'),
(127, 'DECODEUR ', '1', '15', '8', 27, '2025-07-21 14:31:12', '2025-07-21 14:31:12'),
(128, 'FRIGO', '1', '110', '15', 27, '2025-07-21 14:31:12', '2025-07-21 14:31:12'),
(129, 'CAFETIERE ', '1', '1200', '0.5', 27, '2025-07-21 14:31:12', '2025-07-21 14:31:12'),
(130, 'AMPOULES ', '15', '10', '6', 28, '2025-07-30 09:34:06', '2025-07-30 09:34:06'),
(131, 'TV', '1', '80', '8', 28, '2025-07-30 09:34:06', '2025-07-30 09:34:06'),
(132, 'DECODEUR', '1', '15', '8', 28, '2025-07-30 09:34:06', '2025-07-30 09:34:06'),
(133, 'FRIGO', '1', '110', '15', 28, '2025-07-30 09:34:06', '2025-07-30 09:34:06'),
(134, 'CONGELATEUR', '1', '110', '15', 28, '2025-07-30 09:34:06', '2025-07-30 09:34:06'),
(135, 'CLIMATISEURS', '5', '1800', '8', 28, '2025-07-30 09:34:06', '2025-07-30 09:34:06'),
(136, 'Ampoules', '23', '12', '5', 29, '2025-08-16 14:17:42', '2025-08-16 14:17:42'),
(137, 'congelateur', '1', '110', '17', 29, '2025-08-16 14:17:42', '2025-08-16 14:17:42'),
(138, 'ventilateurs solaire', '3', '20', '12', 29, '2025-08-16 14:17:42', '2025-08-16 14:17:42'),
(139, 'televiseur', '1', '80', '10', 29, '2025-08-16 14:17:42', '2025-08-16 14:17:42'),
(140, 'mini sisteme solaire', '1', '200', '6', 30, '2025-08-30 15:38:52', '2025-08-30 15:38:52'),
(141, 'videosurveillance', '1', '25', '8', 31, '2025-08-30 15:50:28', '2025-08-30 15:50:28'),
(142, 'eclairage', '5', '25', '8', 31, '2025-08-30 15:50:28', '2025-08-30 15:50:28'),
(143, 'cameras', '16', '5', '8', 31, '2025-08-30 15:50:28', '2025-08-30 15:50:28'),
(144, 'videosurveillance', '1', '25', '6', 32, '2025-08-30 16:33:42', '2025-08-30 16:33:42'),
(145, 'cameras', '16', '6', '6', 32, '2025-08-30 16:33:42', '2025-08-30 16:33:42'),
(146, 'videosurveillance', '1', '25', '12', 33, '2025-08-30 16:36:12', '2025-08-30 16:36:12'),
(147, 'cameras', '16', '6', '12', 33, '2025-08-30 16:36:12', '2025-08-30 16:36:12'),
(148, 'switch', '1', '10', '12', 33, '2025-08-30 16:36:12', '2025-08-30 16:36:12'),
(149, 'Fer a repasser', '1', '200', '5', 34, '2025-09-10 15:58:21', '2025-09-10 15:58:21'),
(150, 'FRIGO CUISINE', '1', '230', '12', 34, '2025-09-10 15:58:21', '2025-09-10 15:58:21'),
(151, 'CONGELATEUR', '1', '176', '6', 34, '2025-09-10 15:58:21', '2025-09-10 15:58:21'),
(152, 'MACHINE A LAVER', '1', '1300', '5', 34, '2025-09-10 15:58:21', '2025-09-10 15:58:21'),
(153, 'MOULINEX', '1', '1800', '0.5', 34, '2025-09-10 15:58:21', '2025-09-10 15:58:21'),
(154, 'CAFE EXPRESSO', '1', '1200', '5', 34, '2025-09-10 15:58:21', '2025-09-10 15:58:21'),
(155, 'JUS DE FRUIT', '1', '1000', '2', 34, '2025-09-10 15:58:21', '2025-09-10 15:58:21'),
(156, 'ECLAIRAGE SPOT', '24', '12', '12', 34, '2025-09-10 15:58:21', '2025-09-10 15:58:21'),
(157, 'ECLAIRAGE INTERNE', '1', '200', '12', 34, '2025-09-10 15:58:21', '2025-09-10 15:58:21'),
(158, 'FRIGO RECEPTION', '1', '90', '6', 34, '2025-09-10 15:58:21', '2025-09-10 15:58:21'),
(159, 'MARGE DE CONSOMATION', '1', '300', '12', 34, '2025-09-10 15:58:21', '2025-09-10 15:58:21'),
(160, 'MACHINE A LAVER', '1', '1300', '5', 35, '2025-09-10 17:01:54', '2025-09-10 17:01:54'),
(161, 'FER A REPASSER', '1', '2200', '5', 35, '2025-09-10 17:01:54', '2025-09-10 17:01:54'),
(162, 'FRIGO CUISINE', '1', '230', '12', 35, '2025-09-10 17:01:54', '2025-09-10 17:01:54'),
(163, 'COGELATEUR', '1', '176', '6', 35, '2025-09-10 17:01:54', '2025-09-10 17:01:54'),
(164, 'WOUFFER', '1', '320', '15', 35, '2025-09-10 17:01:54', '2025-09-10 17:01:54'),
(165, 'MOULINEX', '1', '1800', '0.5', 35, '2025-09-10 17:01:54', '2025-09-10 17:01:54'),
(166, 'CAFE EXPRESSO', '1', '1200', '5', 35, '2025-09-10 17:01:54', '2025-09-10 17:01:54'),
(167, 'JUS DE FRUITS', '1', '1000', '2', 35, '2025-09-10 17:01:54', '2025-09-10 17:01:54'),
(168, 'ECLAIRAGE ', '1', '400', '12', 35, '2025-09-10 17:01:54', '2025-09-10 17:01:54'),
(169, 'ECLAIRAGE SPOT', '24', '7', '12', 35, '2025-09-10 17:01:54', '2025-09-10 17:01:54'),
(170, 'MACHINE A LAVER', '1', '1300', '5', 36, '2025-09-10 17:40:11', '2025-09-10 17:40:11'),
(171, 'FER A REPASSER', '1', '2200', '5', 36, '2025-09-10 17:40:11', '2025-09-10 17:40:11'),
(172, 'MOULINEX', '1', '1800', '0.5', 36, '2025-09-10 17:40:11', '2025-09-10 17:40:11'),
(173, 'CAFE EXPRESSO', '1', '1200', '2', 36, '2025-09-10 17:40:11', '2025-09-10 17:40:11'),
(174, 'JUS DE FRUITS', '1', '1000', '2', 36, '2025-09-10 17:40:11', '2025-09-10 17:40:11'),
(175, 'MACHINE A LAVER', '1', '1300', '5', 37, '2025-09-10 17:45:52', '2025-09-10 17:45:52'),
(176, 'FER A REPASSER', '1', '2200', '5', 37, '2025-09-10 17:45:52', '2025-09-10 17:45:52'),
(177, 'DESTOP', '7', '80', '8', 38, '2025-10-06 15:59:51', '2025-10-06 15:59:51'),
(178, 'AMPOULES', '8', '10', '8', 38, '2025-10-06 15:59:51', '2025-10-06 15:59:51'),
(179, 'PRISE', '3', '15', '2', 38, '2025-10-06 15:59:51', '2025-10-06 15:59:51'),
(180, 'laptops', '2', '40', '4', 39, '2025-11-13 23:33:35', '2025-11-13 23:33:35'),
(181, 'ampoules', '19', '15', '4', 39, '2025-11-13 23:33:35', '2025-11-13 23:33:35'),
(182, 'ventilateurs classiques', '4', '55', '5', 39, '2025-11-13 23:33:35', '2025-11-13 23:33:35'),
(183, 'TV 45\"', '1', '130', '5', 39, '2025-11-13 23:33:35', '2025-11-13 23:33:35'),
(184, 'TV 32\"', '1', '50', '4', 39, '2025-11-13 23:33:35', '2025-11-13 23:33:35'),
(185, 'laptops', '2', '40', '4', 40, '2025-11-13 23:37:56', '2025-11-13 23:37:56'),
(186, 'ampoules', '12', '15', '4', 40, '2025-11-13 23:37:56', '2025-11-13 23:37:56'),
(187, 'ventilateurs hybrides', '4', '15', '5', 40, '2025-11-13 23:37:56', '2025-11-13 23:37:56'),
(188, 'TV 45\"', '1', '130', '5', 40, '2025-11-13 23:37:56', '2025-11-13 23:37:56'),
(189, 'TV 32\"', '1', '50', '4', 40, '2025-11-13 23:37:56', '2025-11-13 23:37:56'),
(190, 'laptops', '2', '40', '4', 41, '2025-11-13 23:40:11', '2025-11-13 23:40:11'),
(191, 'ampoules', '12', '15', '4', 41, '2025-11-13 23:40:11', '2025-11-13 23:40:11'),
(192, 'ventilateurs hybrides', '4', '15', '5', 41, '2025-11-13 23:40:11', '2025-11-13 23:40:11'),
(193, 'TV 45\"', '1', '130', '5', 41, '2025-11-13 23:40:11', '2025-11-13 23:40:11'),
(194, 'TV 32\"', '1', '50', '4', 41, '2025-11-13 23:40:11', '2025-11-13 23:40:11'),
(195, 'clim 2.5', '1', '1875', '5', 42, '2025-11-22 15:00:21', '2025-11-22 15:00:21'),
(196, 'clim 1.5', '1', '1125', '4', 42, '2025-11-22 15:00:21', '2025-11-22 15:00:21'),
(197, 'pompe ', '1', '1125', '0.5', 42, '2025-11-22 15:00:21', '2025-11-22 15:00:21'),
(198, 'fer a repasser', '1', '1125', '0.5', 42, '2025-11-22 15:00:21', '2025-11-22 15:00:21'),
(199, 'chauffe eau', '1', '750', '0.5', 42, '2025-11-22 15:00:21', '2025-11-22 15:00:21'),
(200, 'machine a laver', '1', '1125', '1.5', 42, '2025-11-22 15:00:21', '2025-11-22 15:00:21'),
(201, 'pompe poissons', '1', '600', '13', 42, '2025-11-22 15:00:21', '2025-11-22 15:00:21'),
(202, 'ensemble TV', '1', '150', '8', 42, '2025-11-22 15:00:21', '2025-11-22 15:00:21'),
(203, 'refrigerateur', '2', '150', '16', 42, '2025-11-22 15:00:21', '2025-11-22 15:00:21'),
(204, 'laptop', '2', '50', '5', 42, '2025-11-22 15:00:21', '2025-11-22 15:00:21'),
(205, 'eclairage', '1', '100', '5', 42, '2025-11-22 15:00:21', '2025-11-22 15:00:21'),
(206, 'ventilateur ', '2', '55', '9', 42, '2025-11-22 15:00:21', '2025-11-22 15:00:21'),
(207, 'clim 2.5', '1', '1875', '5', 43, '2025-11-22 15:01:01', '2025-11-22 15:01:01'),
(208, 'clim 1.5', '1', '1125', '4', 43, '2025-11-22 15:01:01', '2025-11-22 15:01:01'),
(209, 'pompe ', '1', '1125', '0.5', 43, '2025-11-22 15:01:01', '2025-11-22 15:01:01'),
(210, 'fer a repasser', '1', '1125', '0.5', 43, '2025-11-22 15:01:01', '2025-11-22 15:01:01'),
(211, 'chauffe eau', '1', '750', '0.5', 43, '2025-11-22 15:01:01', '2025-11-22 15:01:01'),
(212, 'machine a laver', '1', '1125', '1.5', 43, '2025-11-22 15:01:01', '2025-11-22 15:01:01'),
(213, 'pompe poissons', '1', '600', '13', 43, '2025-11-22 15:01:01', '2025-11-22 15:01:01'),
(214, 'ensemble TV', '1', '150', '8', 43, '2025-11-22 15:01:01', '2025-11-22 15:01:01'),
(215, 'refrigerateur', '2', '150', '16', 43, '2025-11-22 15:01:01', '2025-11-22 15:01:01'),
(216, 'laptop', '2', '50', '5', 43, '2025-11-22 15:01:01', '2025-11-22 15:01:01'),
(217, 'eclairage', '1', '100', '5', 43, '2025-11-22 15:01:01', '2025-11-22 15:01:01'),
(218, 'ventilateur ', '2', '55', '9', 43, '2025-11-22 15:01:01', '2025-11-22 15:01:01'),
(219, 'pompe forage', '1', '1500', '0.5', 44, '2025-11-27 16:35:45', '2025-11-27 16:35:45'),
(220, 'fer a repasser', '1', '1500', '0.5', 44, '2025-11-27 16:35:45', '2025-11-27 16:35:45'),
(221, 'chauffe eau', '1', '1000', '0.5', 44, '2025-11-27 16:35:45', '2025-11-27 16:35:45'),
(222, 'machine a laver ', '1', '500', '1', 44, '2025-11-27 16:35:45', '2025-11-27 16:35:45'),
(223, 'pompe poisson', '1', '800', '12', 44, '2025-11-27 16:35:45', '2025-11-27 16:35:45'),
(224, 'pack TV', '1', '150', '8', 44, '2025-11-27 16:35:45', '2025-11-27 16:35:45'),
(225, 'congelateur+ refrigerateur', '1', '250', '15', 44, '2025-11-27 16:35:45', '2025-11-27 16:35:45'),
(226, 'laptop', '2', '45', '5', 44, '2025-11-27 16:35:45', '2025-11-27 16:35:45'),
(227, 'ventilateur hybride', '2', '15', '12', 44, '2025-11-27 16:35:45', '2025-11-27 16:35:45'),
(228, 'eclairage', '1', '100', '6', 44, '2025-11-27 16:35:45', '2025-11-27 16:35:45');

-- --------------------------------------------------------

--
-- Structure de la table `besoin_particuliers`
--

CREATE TABLE `besoin_particuliers` (
  `id` bigint(20) UNSIGNED NOT NULL,
  `titre` varchar(255) DEFAULT NULL,
  `suivi_id` bigint(20) UNSIGNED DEFAULT NULL,
  `created_at` timestamp NULL DEFAULT NULL,
  `updated_at` timestamp NULL DEFAULT NULL
) ENGINE=InnoDB DEFAULT CHARSET=utf8mb4 COLLATE=utf8mb4_unicode_ci;

--
-- Déchargement des données de la table `besoin_particuliers`
--

INSERT INTO `besoin_particuliers` (`id`, `titre`, `suivi_id`, `created_at`, `updated_at`) VALUES
(1, '3 projecteurs solaires (pour marie-lumiere)', 1, '2025-07-24 12:27:49', '2025-07-24 12:27:49'),
(2, '1 batterie lithium ATP 5KWH -24V', 1, '2025-07-24 12:27:49', '2025-07-24 12:27:49'),
(3, 'Accessoires de protection batterie + installation ', 1, '2025-07-24 12:27:49', '2025-07-24 12:27:49'),
(4, 'POMPE 50M', 2, '2025-08-01 12:29:41', '2025-08-01 12:29:41'),
(5, 'Demande de fixation de de date pour installer la batterie lithium ', 1, '2025-08-02 12:20:52', '2025-08-02 12:20:52'),
(6, 'une solution qui peut alimenter 04 ampoules , le téléphone et la radio ', 3, '2025-08-04 09:01:18', '2025-08-04 09:01:18'),
(7, 'elle a un puit aménage de 15m et souhaite l\'alimenter au solaire ', 4, '2025-08-08 14:04:01', '2025-08-08 14:04:01'),
(8, 'il a besoin d\'une solution autonome avec possibilité de l\'agrandir pour son bar ', 5, '2025-08-08 14:10:41', '2025-08-08 14:10:41'),
(9, 'il veut la pompe de 155M hybride avec son système d\'alimentation ', 6, '2025-08-08 14:16:53', '2025-08-08 14:16:53'),
(10, 'il veut une pompe solaire pour un puit de 70M ', 7, '2025-08-08 14:24:04', '2025-08-08 14:24:04'),
(11, 'convertisseurs aurora 48v', 8, '2025-08-11 16:08:30', '2025-08-11 16:08:30'),
(12, 'une solution  qui peut alimenter 01 tv 65\" 01 frigo/congelateur 08 ampoules ', 9, '2025-08-13 10:47:02', '2025-08-13 10:47:02'),
(13, 'pompe solaire pour un puit de moins de 40m ', 10, '2025-08-13 10:59:34', '2025-08-13 10:59:34'),
(14, 'il veut deux pompes pour différents site Yaoundé et Mbalmayo', 12, '2025-09-15 14:22:13', '2025-09-15 14:22:13'),
(15, 'Pompe 60M', 13, '2025-10-01 13:42:00', '2025-10-01 13:42:00');

-- --------------------------------------------------------

--
-- Structure de la table `bon_commandes`
--

CREATE TABLE `bon_commandes` (
  `id` bigint(20) UNSIGNED NOT NULL,
  `compte_id` bigint(20) UNSIGNED DEFAULT NULL,
  `montant` varchar(255) DEFAULT NULL,
  `titre` varchar(255) DEFAULT NULL,
  `user_id` bigint(20) UNSIGNED DEFAULT NULL,
  `date_livraison` varchar(255) DEFAULT NULL,
  `date_commande` varchar(255) DEFAULT NULL,
  `status` varchar(255) NOT NULL DEFAULT 'En attente',
  `frais` varchar(255) DEFAULT NULL,
  `created_at` timestamp NULL DEFAULT NULL,
  `updated_at` timestamp NULL DEFAULT NULL
) ENGINE=InnoDB DEFAULT CHARSET=utf8mb4 COLLATE=utf8mb4_unicode_ci;

--
-- Déchargement des données de la table `bon_commandes`
--

INSERT INTO `bon_commandes` (`id`, `compte_id`, `montant`, `titre`, `user_id`, `date_livraison`, `date_commande`, `status`, `frais`, `created_at`, `updated_at`) VALUES
(1, 6, '30000', 'Mr. TICHA BONAMOUSSADI', 9, '2025-08-04', '2025-08-04', 'En attente', '1800', '2025-08-04 18:00:40', '2025-08-04 18:00:40'),
(2, 6, '30000', 'QUIFEROU AKWA DOUCHE', 9, '2025-08-04', '2025-08-04', 'livré', '1800', '2025-08-04 18:09:14', '2025-08-04 18:09:27');

-- --------------------------------------------------------

--
-- Structure de la table `bon_commande_produit`
--

CREATE TABLE `bon_commande_produit` (
  `id` bigint(20) UNSIGNED NOT NULL,
  `bon_commande_id` bigint(20) UNSIGNED NOT NULL,
  `produit_id` bigint(20) UNSIGNED NOT NULL,
  `quantity` int(11) NOT NULL DEFAULT 1,
  `price` varchar(255) DEFAULT NULL,
  `created_at` timestamp NULL DEFAULT NULL,
  `updated_at` timestamp NULL DEFAULT NULL
) ENGINE=InnoDB DEFAULT CHARSET=utf8mb4 COLLATE=utf8mb4_unicode_ci;

--
-- Déchargement des données de la table `bon_commande_produit`
--

INSERT INTO `bon_commande_produit` (`id`, `bon_commande_id`, `produit_id`, `quantity`, `price`, `created_at`, `updated_at`) VALUES
(1, 1, 55, 100, '750', NULL, NULL),
(2, 2, 55, 100, '750', NULL, NULL);

-- --------------------------------------------------------

--
-- Structure de la table `categoris`
--

CREATE TABLE `categoris` (
  `id` bigint(20) UNSIGNED NOT NULL,
  `titre` varchar(255) NOT NULL,
  `description` longtext DEFAULT NULL,
  `image_categorie` varchar(255) DEFAULT NULL,
  `created_at` timestamp NULL DEFAULT NULL,
  `updated_at` timestamp NULL DEFAULT NULL
) ENGINE=InnoDB DEFAULT CHARSET=utf8mb4 COLLATE=utf8mb4_unicode_ci;

--
-- Déchargement des données de la table `categoris`
--

INSERT INTO `categoris` (`id`, `titre`, `description`, `image_categorie`, `created_at`, `updated_at`) VALUES
(10, 'BATTERIE GEL', 'batteries à l\'électrolyte gélifié', '1829580019350788.BATTERIES PLOMB et lithium.jpg', '2024-06-25 09:10:19', '2025-04-16 18:11:14'),
(11, 'KITS, PACKS et ASSEMBLAGE', 'assemblage non compact avec possibilité d\'assembler sous forme compacte dans un boitier et ayant pour but de résoudre un problème de consommation spécifique bien circoncis', '1833998526305137.PACKS.jpg', '2024-06-25 09:14:49', '2025-06-04 12:41:30'),
(12, 'CONTRÔLEUR DE CHARGE PWM', 'contrôleur de charge qui limite les niveaux des paramètres de charge venant  des panneaux en direction des batteries', '1833986349561920.Cathalogue Controleur PWM.jpg', '2024-06-25 09:17:13', '2025-06-04 09:27:58'),
(14, 'CONTROLEUR DE CHARGE MPPT', 'régulateur de charge modifiant les caractéristiques de départ du champ photovoltaïque pour les adapter à l\'état de la batterie en vu de soustraire le maximum de puissance du panneau et de le transmettre aux batteries', '1833986372021025.Cathalogue Controleur MPPT.jpg', '2024-06-25 09:21:25', '2025-06-04 09:28:19'),
(15, 'RAILS, CLAMP ET FIXATION PANNEAUX', 'éléments permettant de fixer le panneau solaire au toit ou sur structure au sol', '1833986455707521.Cathalogue Rails, Clams et fixations.jpg', '2024-06-25 09:31:57', '2025-06-04 09:29:39'),
(16, 'CONNECTEURS MC4', 'connecteurs permettant de lier le panneau solaire aux câblages de la suite de l\'installation', '1833986486930703.Cathalogue Connecteur MC4.jpg', '2024-06-25 09:36:39', '2025-06-04 09:30:09'),
(17, 'CÂBLES', 'Cable solaire, Cable pour installation DC, Cable pour installation AC, Cable image, Cable RG59', '1833986504576373.Cables.jpg', '2024-06-25 09:56:43', '2025-06-04 09:30:26'),
(18, 'CONVERTISSEUR SINUS MODIFIER', 'Un convertisseur sinus modifié (ou onduleur à onde sinusoïdale modifiée) peut être utilisé dans une installation solaire, Il transforme le courant continu (DC) de votre batterie solaire en courant alternatif (AC) avec une onde pseudo-sinusoïdale (pas parfaitement lisse comme l’onde du réseau électrique).', '1833986531250890.Cathalogue Convertisseur SInus modifier.jpg', '2024-06-25 10:02:51', '2025-06-04 09:30:51'),
(19, 'CONVERTISSEUR PURE SINUS', 'PURE SINE CONVERTERS and hybrid converters', '1833986560116887.Cathalogue Convertisseur hybride pure sinus.jpg', '2024-06-25 10:03:21', '2025-06-04 09:31:19'),
(20, 'LAMPE DC', 'Conçue pour fonctionner directement avec une alimentation en courant continu, comme celle produite par des panneaux solaires, des batteries ou des alimentations 12V .', '1833986693923035.Cathalogue Lampes DC.jpg', '2024-06-25 10:13:47', '2025-06-04 09:33:26'),
(21, 'PANNEAUX SOLAIRES', 'photovoltaïque', '1829765064767077.AVAILABLE SOLAR PANELS.jpg', '2024-06-25 10:39:06', '2025-04-18 19:12:27'),
(23, 'VENTILATEUR SOLAIRE', 'SOLAIRE SIMPLE\nSOLAIRE HYBRIDE\nSOLAIRE AUTONOME', '1833986759421354.Cathalogue Ventilateur solaire.jpg', '2024-06-29 10:24:04', '2025-06-04 09:34:29'),
(25, 'INTERRUPTEUR- PRISES', 'ENCASTRÉ:\n- SIMPLE ALUMAGE\n-simple va et viens\n- double simple\n- double va et viens \n- bouton poussoir\n- prises \n\nAPPARENTS:\n- SIMPLE ALUMAGE\n-simple va et viens\n- double simple\n- double va et viens \n- bouton poussoir\n- prises', '1833986826600216.Cathalogue INTERRUPTEUR ET PRISES.jpg', '2024-07-01 09:49:37', '2025-06-04 09:35:33'),
(26, 'FIXATION', 'ATTACHES\nVICES \nCHEVILLES', '1833986855582762.Cathalogue ATTACHE.jpg', '2024-07-01 15:52:32', '2025-06-04 09:36:00'),
(27, 'IMAGES', 'TELEVISEUR\nDECODEUR\nPARABOLE', '1833993237859376.PARABOLE COMPLETE.jpg', '2024-07-01 15:54:13', '2025-06-04 11:17:27'),
(28, 'PLOMBERIE', 'tuyaux \nraccords\ncubitenaire', '1833986884034347.Cathalogue Plombérie.jpg', '2024-07-09 11:50:03', '2025-06-04 09:36:27'),
(29, 'TELEVISEUR', 'Appareil électronique conçu pour recevoir, décoder et afficher des images et du son en provenance de diverses sources (antenne, câble, satellite, Internet, lecteur multimédia, etc.). Aujourd\'hui, les téléviseurs modernes offrent des fonctionnalités avancées telles que l\'accès à Internet, le streaming, les jeux, et bien plus encore.\n- 19\'\'\n- 22\"\n-24\"\n- 26\"\n- 28\"\n- 32\"\n- 37\"\n- 42\"\n- 43\"\n- 46\"\n- 48\"\n- 50\"\n- 55\"', '1833986923107851.Cathalogue téléviseur.jpg', '2024-07-09 14:35:10', '2025-06-04 09:37:05'),
(30, 'CONNECTEUR', 'Appareillage utilisé pour la connexion de circuits ou d\'appareils.', '1833986950376191.Cathalogue connecteur électrique.jpg', '2024-07-12 12:15:00', '2025-06-04 09:37:31'),
(32, 'LAMPES ET LUSTRE AC', 'Lampes base consommation pour les système solaire', '1833986977058353.Cathalogue Lampes AC.jpg', '2024-07-26 10:09:58', '2025-06-04 09:37:56'),
(33, 'PROTECTION ELECTRIQUE DPN ,PARAFOUDRE ET LIMITEUR DE TENSION', 'Dispositif de sécurité utilisé dans les installations électriques pour protéger les circuits contre les surintensités, les courts-circuits et les défauts de terre. Protège les installations électriques et les équipements contre les surtensions transitoires générées principalement par la foudre\n...', '1833987049100342.Cathalogue disjoncteur .jpg', '2024-09-16 12:43:00', '2025-06-04 09:39:05'),
(34, 'INVERSEUR DE SOURCE', 'Dispositif électrique permettant de basculer automatiquement ou manuellement l\'alimentation électrique entre deux sources distinctes. Il est souvent utilisé pour garantir une alimentation continue en cas de coupure de courant, en passant d\'une source principale (réseau électrique) à une source secondaire (générateur, panneaux solaires, batterie).', '1833987115073734.Cathalogue inversseur de source.jpg', '2024-09-20 12:09:08', '2025-06-04 09:40:08'),
(35, 'POMPE SOLAIRE DC ET AC/DC', 'Dispositif permettant de pomper de l\'eau en utilisant l\'énergie fournie par le soleil. La pompe solaire fonctionne en courant continue et ou en courant alternatif', '1833987163400143.Cathalogue pompe DC et AC-DC.jpg', '2024-10-02 12:14:39', '2025-06-04 09:40:54'),
(36, 'GENERATEUR SOLAIRE ET PACK', 'système autonome qui convertit l\'énergie solaire en électricité grâce à des panneaux photovoltaïques. Il permet d\'alimenter divers appareils électriques, même en l\'absence de réseau électrique, en stockant l\'énergie dans des batteries.', '1833987205122206.Cathalogue GENERATEUR SOLAIRE.jpg', '2024-11-02 10:38:55', '2025-06-04 09:41:34'),
(37, 'PROJECTEUR ET LAMPADAIRES', 'Pour éclairage extérieur', '1833987237158595.Cathalogue Lampadaire et projecteurs.jpg', '2024-11-02 16:25:58', '2025-06-04 09:42:04'),
(38, 'POMPE AC', 'Pompe électrique a courant alternatif 230Vac', '1833987331065359.Cathalogue Pompe AC.jpg', '2025-02-12 18:03:57', '2025-06-04 09:43:34'),
(40, 'OUTILS DE MESURES', 'WATTMÈTRE\nMULTIMETRE\nMETRES', '1833987349747450.Cathalogue appareils de mesure.jpg', '2025-03-10 17:30:50', '2025-06-04 09:43:52'),
(42, 'BATTERIE LITHIUM-ION', 'Dispositif de stockage d\'énergie électrique utilisant le lithium comme élément actif.', '1833987398129193.Cathalogue BATTERIE LITHIUM.jpg', '2025-03-19 11:54:29', '2025-06-04 09:44:38'),
(43, 'VIDEO SURVEILLANCE', 'Intègre tout les équipements de vidéo surveillance', '1829765870837670.VIDEO SURVEILLANCE.jpg', '2025-04-17 16:52:18', '2025-04-18 19:25:16'),
(44, 'COFFRET ET BOITTE DE DERIVATION ELECTRIQUE', 'Protection des circuits électriques contre les chocs mécanique, intempéries et poussière.', '1833987376816833.Cathalogue Boitte et coffret.jpg', '2025-05-12 14:16:24', '2025-06-04 09:44:17'),
(45, 'COSSE BATTERIE', 'Les cosses de batterie sont des connecteurs métalliques utilisés pour fixer les câbles électriques aux bornes d\'une batterie. Elles sont conçues pour assurer un bon contact électrique et minimiser les pertes de courant.', '1833987415992907.Cathalogue Cosse bat.jpg', '2025-05-14 15:15:15', '2025-06-04 09:44:55');

-- --------------------------------------------------------

--
-- Structure de la table `charges`
--

CREATE TABLE `charges` (
  `id` bigint(20) UNSIGNED NOT NULL,
  `titre` varchar(255) NOT NULL,
  `montant` double NOT NULL,
  `date` varchar(255) DEFAULT NULL,
  `created_at` timestamp NULL DEFAULT NULL,
  `updated_at` timestamp NULL DEFAULT NULL
) ENGINE=InnoDB DEFAULT CHARSET=utf8mb4 COLLATE=utf8mb4_unicode_ci;

--
-- Déchargement des données de la table `charges`
--

INSERT INTO `charges` (`id`, `titre`, `montant`, `date`, `created_at`, `updated_at`) VALUES
(6, 'achat chignole makita', 14000, '2024-06-28', '2024-07-01 08:55:57', '2024-07-01 08:55:57'),
(7, 'forfait appel SIM SOLERGY', 1000, '2024-07-10', '2024-07-10 09:51:57', '2024-07-10 09:51:57'),
(8, 'TRANSPORT NOUVELLE ASSISTANTE: FRANCINE', 5000, '2024-07-10', '2024-07-10 14:40:28', '2024-07-10 14:40:28'),
(9, 'LOYER DE SEPTEMBRE', 70000, '2024-07-23', '2024-07-23 13:02:51', '2024-07-23 13:02:51'),
(10, 'FORFAIT APPEL SOLERGY', 1000, '2024-07-23', '2024-07-23 13:04:15', '2024-07-23 13:04:15'),
(11, 'commission cabrel pack TV26\"+6 ampoules solaires', 13500, '2024-07-24', '2024-07-26 04:12:39', '2024-07-26 04:12:39'),
(12, 'Installation pack TV26\"+ampoule solaires+ images', 15000, '2024-07-24', '2024-07-26 04:14:29', '2024-07-26 04:14:29'),
(13, '0', 0, '2024-07-26', '2024-07-26 19:08:34', '2024-07-26 19:08:34'),
(14, '0', 0, '2024-07-19', '2024-07-26 20:11:27', '2024-07-26 20:11:27'),
(15, 'commission cabrel systeme TV de 270000', 135000, '2024-07-24', '2024-07-27 11:19:28', '2024-07-27 11:19:28'),
(16, 'FRAIS installaion PACK TV+6AMPOULES+IMAGES', 15000, '2024-07-24', '2024-07-27 11:26:46', '2024-07-27 11:26:46'),
(17, 'ACHAT TESTEUR DE BATTERIE', 45000, '2024-07-27', '2024-07-30 13:38:46', '2024-07-30 13:38:46'),
(18, 'ACHAT DISJONCTEUR BATTERIE (FAUSTIN)', 25000, '2024-07-27', '2024-07-30 13:41:24', '2024-07-30 13:41:24'),
(19, 'ACHAT FLYBOX ILLIMITE ORANGE', 47000, '2024-07-30', '2024-07-30 13:46:14', '2024-07-30 13:46:14'),
(20, 'dividendes cabrel', 225000, '2024-08-01', '2024-08-01 18:46:41', '2024-08-01 18:46:41'),
(21, 'Dividendes Faustin', 75000, '2024-08-01', '2024-08-01 18:47:35', '2024-08-01 18:47:35'),
(22, 'avance Jaulmes application', 30000, '2024-08-01', '2024-08-01 18:48:56', '2024-08-01 18:48:56'),
(23, 'FORFAIT APPEL ORANGE', 1000, '2024-09-13', '2024-09-16 07:24:25', '2024-09-16 07:24:25'),
(24, 'ACHAT  BOX CHIGNOLE FATEWEI 3en 1', 71000, '2024-09-19', '2024-09-19 11:42:04', '2024-09-19 11:42:04'),
(25, 'Adhésion ICIYATOUT communication', 15000, '2024-09-25', '2024-09-25 15:21:33', '2024-09-25 15:21:33'),
(26, 'PAIEMENT LOYER AU COLLEGE BENEDICTE', 70000, '2024-10-04', '2024-10-04 08:59:27', '2024-10-04 08:59:27'),
(27, 'dividende septembre cabrel', 225000, '2024-10-04', '2024-10-04 09:01:22', '2024-10-04 09:01:22'),
(28, 'dividendes faustin septembre', 75000, '2024-10-04', '2024-10-04 09:02:14', '2024-10-04 09:02:14'),
(29, 'OTVP TRIMETRE 3 et 4', 37000, '2024-10-09', '2024-10-11 11:28:53', '2024-10-11 11:28:53'),
(30, 'ACHAT EMBALLAGES 200', 400, '2024-11-02', '2024-11-02 16:42:58', '2024-11-02 16:42:58'),
(31, 'remise argent sedar', 77500, '2024-11-02', '2024-11-02 17:11:43', '2024-11-02 17:11:43'),
(32, 'RETAIT POUR PUBLICITE FACBOOK (PAYSIKA)', 100000, '2024-11-04', '2024-11-04 14:44:14', '2024-11-04 14:44:14'),
(33, 'BAIL NOVEMBRE', 70000, '2024-11-05', '2024-11-05 09:32:17', '2024-11-05 09:32:17'),
(34, 'DIVIDENDES FAUSTIN', 75000, '2024-11-05', '2024-11-05 09:40:28', '2024-11-05 09:40:28'),
(35, 'DIVIDENDES CABREL', 225000, '2024-11-05', '2024-11-05 09:41:47', '2024-11-05 09:41:47'),
(36, 'DETTE COURSES FAUSTIN', 7500, '2024-11-06', '2024-11-07 11:30:41', '2024-11-07 11:30:41'),
(37, 'INSTALLATION SEDAR', 10000, '2024-11-06', '2024-11-07 11:32:23', '2024-11-07 11:33:47'),
(38, 'TRANSPORT COURSES DU JOUR', 2600, '2024-11-06', '2024-11-07 11:44:16', '2024-11-07 11:44:16'),
(39, 'FORFAIT ILLIMITE MTN NOVEMBRE', 14900, '2024-11-06', '2024-11-07 11:45:32', '2024-11-07 11:45:32'),
(40, 'RETRAIT JOE CARGO MINI-POMPE+MC4', 25000, '2024-11-06', '2024-11-07 11:47:42', '2024-11-07 11:47:42'),
(41, 'TRANSPORT  (benedicte-akwa-bénédicte)', 800, '2024-12-10', '2024-12-10 17:52:18', '2024-12-10 17:52:18'),
(42, 'achat multimètre MAS830 VERT', 2000, '2024-12-10', '2024-12-10 17:55:30', '2024-12-10 17:55:30'),
(43, 'ACHAT MULTIMETRE DT266 CLAMP', 3000, '2024-12-10', '2024-12-10 17:57:19', '2024-12-10 17:57:19'),
(44, 'PAIEMENT SALAIRE MYRIAM', 69500, '2024-12-10', '2024-12-10 17:58:18', '2024-12-10 17:58:18'),
(45, 'TRANSPORT MAURICE BOMONO', 3000, '2024-12-10', '2024-12-10 18:01:36', '2024-12-10 18:01:36'),
(46, 'TRANSPORT MAURICE-SERGE (bénédicte-kotto-bénédicte)', 6000, '2024-12-09', '2024-12-10 18:04:33', '2024-12-10 18:04:33'),
(47, 'TRANSPORT', 2500, '2024-12-11', '2024-12-12 11:01:28', '2024-12-12 11:01:28'),
(48, 'AVANCE ACHAT POLOS ET FLOQUAGE 80K/116K', 80000, '2024-12-11', '2024-12-12 11:03:07', '2024-12-12 11:03:07'),
(49, 'ACHAT POTS DE PEINTURE', 5000, '2024-12-11', '2024-12-12 11:15:59', '2024-12-12 11:15:59'),
(50, 'ACHATS AUTOCOLLANT PLAFOND', 10000, '2024-12-11', '2024-12-12 11:17:45', '2024-12-12 11:17:45'),
(51, 'TRANSPORTS (Panneaux alltop course+deplacements)', 4800, '2024-12-12', '2024-12-12 17:33:16', '2024-12-12 17:33:16'),
(52, 'PAYEMENT PUBLICITE FACEBOOK NOVEMBRE', 61904, '2024-12-13', '2024-12-13 16:02:12', '2024-12-13 16:02:12'),
(53, 'complément réalisation du spot', 10200, '2024-12-18', '2024-12-18 09:54:35', '2024-12-18 09:54:35'),
(54, 'ACHAT STRUCTURE POMPAGE BABENGHA', 50000, '2024-12-21', '2024-12-24 13:24:53', '2024-12-24 13:24:53'),
(55, 'TRANSPORT STRUCTURE  POMPAGE BABENGHA', 12200, '2024-12-21', '2024-12-24 13:25:55', '2024-12-24 13:25:55'),
(56, '4 ACHAT CAMERAS AMPOULE', 16000, '2024-12-24', '2024-12-24 13:27:46', '2024-12-24 13:27:46'),
(57, 'ACHAT MINI PROJECTEUR', 9000, '2024-12-24', '2024-12-24 13:28:29', '2024-12-24 13:28:29'),
(58, 'TRANSPORT AKWA', 1000, '2024-12-24', '2024-12-24 13:29:12', '2024-12-24 13:29:12'),
(59, 'commission pour l\'intallation de mr YOKORO JEAN VALERE a MYRIAM', 0, '2024/12/31', '2024-12-31 11:20:53', '2024-12-31 11:20:53'),
(60, 'commission pour l\'intallation de fioie a anoudem', 0, '2025/01/02', '2025-01-02 12:02:31', '2025-01-02 12:02:31'),
(61, 'commission pour l\'intallation de fioie a anoudem', 0, '2025/01/02', '2025-01-02 12:04:20', '2025-01-02 12:04:20'),
(62, 'commission pour l\'intallation de fioie a anoudem', 0, '2025/01/02', '2025-01-02 12:04:37', '2025-01-02 12:04:37'),
(63, 'commission pour l\'intallation de fioie a anoudem', 0, '2025/01/02', '2025-01-02 12:06:37', '2025-01-02 12:06:37'),
(64, 'abc', 0, '2025-01-13', '2025-01-13 07:57:15', '2025-01-13 07:57:15'),
(65, 'commission pour l\'intallation de MR OUSSOUMANOU a MYRIAM', 0, '2025/01/15', '2025-01-15 09:48:50', '2025-01-15 09:48:50'),
(66, 'commission pour l\'intallation de MR OUSSOUMANOU a MYRIAM', 0, '2025/01/15', '2025-01-15 10:39:26', '2025-01-15 10:39:26'),
(67, 'Payement publicité facebook', 53543, '2025-01-16', '2025-01-18 14:07:48', '2025-01-18 14:07:48'),
(68, 'Transfert OM vers Paysika', 50000, '2025-01-16', '2025-01-18 14:10:37', '2025-01-18 14:10:37'),
(69, 'commission pour l\'intallation de mr GERALD NJIE a MYRIAM', 0, '2025/01/27', '2025-01-27 14:16:27', '2025-01-27 14:16:27'),
(70, 'commission pour l\'intallation de SIEKO a Cabrel', 27850, '2025/01/27', '2025-01-27 16:57:40', '2025-01-27 16:57:40'),
(71, 'Installatio SEDAR NKOTO', 14900, '2025-01-25', '2025-01-27 17:33:17', '2025-01-27 17:33:17'),
(72, 'Installation SIEKO(trans+achat disjoncteur)', 10200, '2025-01-27', '2025-01-27 17:39:12', '2025-01-27 17:39:12'),
(73, 'commission pour l\'intallation de ATOH STANLE a Cabrel', 26500, '2025/01/28', '2025-01-28 15:43:46', '2025-01-28 15:43:46'),
(74, 'commission pour l\'intallation de SIEKO a Cabrel', 27850, '2025/01/28', '2025-01-28 15:55:26', '2025-01-28 15:55:26'),
(75, 'commission pour l\'intallation de Mr RUBIEL a Cabrel', 23500, '2025/02/04', '2025-02-04 11:06:14', '2025-02-04 11:06:14'),
(76, 'Dividende Cabrel', 225000, '2025-02-03', '2025-02-04 18:24:58', '2025-02-04 18:24:58'),
(77, 'Dividende Faustin', 75000, '2025-02-03', '2025-02-04 18:25:31', '2025-02-04 18:25:31'),
(78, 'Avance JAULMES', 30000, '2025-02-04', '2025-02-04 19:04:22', '2025-02-04 19:04:22'),
(79, 'Transport Pour meublé Ndogbong', 2000, '2025-02-05', '2025-02-05 11:04:50', '2025-02-05 11:04:50'),
(80, 'Frais huissier', 30000, '2025-02-05', '2025-02-05 17:56:10', '2025-02-05 17:56:10'),
(81, 'commission pour l\'intallation de EFFICIENCE PLUS SERVICES SARL a Cabrel', 22500, '2025/02/08', '2025-02-08 10:23:03', '2025-02-08 10:23:03'),
(82, 'commission pour l\'intallation de EFFICIENCE PLUS SERVICES SARL a Cabrel', 22500, '2025/02/08', '2025-02-08 10:29:22', '2025-02-08 10:29:22'),
(83, 'Transport matériels et Rafraichissement Mr.Bruel', 17100, '2025-02-08', '2025-02-10 09:58:50', '2025-02-10 09:58:50'),
(84, 'Main d\'ouevre Mauris Mr. Bruel', 2000, '2025-02-08', '2025-02-10 10:28:38', '2025-02-10 10:28:38'),
(85, 'Salaire Myriam', 42500, '2025-02-10', '2025-02-10 13:04:35', '2025-02-10 13:04:35'),
(86, 'TRANSPORT MAURICE + FRAIS DE BOUCHE SEDAR', 6000, '2025-02-10', '2025-02-14 17:47:25', '2025-02-14 17:47:25'),
(87, 'TRANSPORT ngodi + kotto', 3000, '2025-02-13', '2025-02-14 17:48:44', '2025-02-14 17:48:44'),
(88, 'solution ngodi+bali+bomono', 6500, '2025-02-14', '2025-02-14 17:53:17', '2025-02-14 17:53:17'),
(89, 'recharge crédit tout réseaux solergy', 1000, '2025-02-14', '2025-02-15 17:09:06', '2025-02-15 17:09:06'),
(90, 'DOTATION APPELS MYRIAM FEVRIER', 1000, '2025-02-15', '2025-02-15 17:09:58', '2025-02-15 17:09:58'),
(91, 'TRANSPORT MAURICE POUR BOMONO', 3000, '2025-02-15', '2025-02-15 17:12:39', '2025-02-15 17:12:39'),
(92, 'commission pour l\'intallation de SEDAR a TECHNICIEN', 0, '2025/02/15', '2025-02-15 18:55:15', '2025-02-15 18:55:15'),
(93, 'commission pour l\'intallation de 0 a 0', 0, '2025/02/16', '2025-02-16 20:35:36', '2025-02-16 20:35:36'),
(94, 'commission pour l\'intallation de 0 a 0', 0, '2025/02/16', '2025-02-16 21:22:23', '2025-02-16 21:22:23'),
(95, 'commission pour l\'intallation de 0 a 0', 0, '2025/02/16', '2025-02-16 21:46:26', '2025-02-16 21:46:26'),
(96, 'achat du rouleau de flashband', 3000, '2025-02-17', '2025-02-17 13:13:54', '2025-02-17 13:13:54'),
(97, 'ACHAT paquet de stylos bleu', 2000, '2025-02-17', '2025-02-17 13:14:44', '2025-02-17 13:14:44'),
(98, 'commission pour l\'intallation de SEDAR a CABREL', 0, '2025/02/18', '2025-02-18 14:58:14', '2025-02-18 14:58:14'),
(99, 'paiement ministère du commerce', 30000, '2025-02-18', '2025-02-26 11:34:41', '2025-02-26 11:34:41'),
(100, 'paiement huissier pour CONSTAT+SOMMATION bailleur SIMO(collège Bénédicte)', 35000, '2025-02-18', '2025-02-26 11:42:58', '2025-02-26 11:42:58'),
(101, 'commission pour l\'intallation de  a Faustin', 0, '2025/02/26', '2025-02-26 11:43:29', '2025-02-26 11:43:29'),
(102, 'commission pour l\'intallation de  a Faustin', 0, '2025/02/26', '2025-02-26 11:45:34', '2025-02-26 11:45:34'),
(103, 'commission pour l\'intallation de  a Faustin', 0, '2025/02/26', '2025-02-26 11:48:21', '2025-02-26 11:48:21'),
(104, 'TRANSPORT jaulmes', 1000, '2025-02-26', '2025-02-26 18:06:46', '2025-02-26 18:06:46'),
(105, 'Dividende CABREL', 225000, '2025-03-01', '2025-03-03 13:59:19', '2025-03-03 13:59:19'),
(106, 'Dividende FAUSTIN', 75000, '2025-03-01', '2025-03-03 13:59:55', '2025-03-03 13:59:55'),
(107, 'Transport et rafraichissement', 6000, '2025-03-04', '2025-03-05 10:00:46', '2025-03-05 10:00:46'),
(108, 'Transport pour réparation convertisseur Mr.Ngongang et achat marchandises', 2200, '2025-03-04', '2025-03-05 10:02:38', '2025-03-05 10:02:38'),
(109, 'Devis de branchement énéo', 49000, '2025-03-19', '2025-03-19 12:29:57', '2025-03-19 12:29:57'),
(110, 'commission pour l\'intallation de  a MYRIAM', 0, '2025/03/22', '2025-03-22 08:50:35', '2025-03-22 08:50:35'),
(111, 'Dividende Cabrel', 225000, '2025-04-09', '2025-04-10 11:15:48', '2025-04-10 11:15:48'),
(112, 'Dividende Faustin', 75000, '2025-04-09', '2025-04-10 11:16:29', '2025-04-10 11:16:29'),
(113, 'Commission Cabrel', 138750, '2025-04-09', '2025-04-10 11:18:05', '2025-04-10 11:18:05'),
(114, 'Commission Faustin', 33100, '2025-04-09', '2025-04-10 11:18:57', '2025-04-10 11:18:57'),
(115, 'Salaire Miryam', 40000, '2025-04-10', '2025-04-10 11:20:12', '2025-04-10 11:20:12'),
(116, 'Commission Miryam', 4000, '2025-04-10', '2025-04-10 11:20:49', '2025-04-10 11:20:49'),
(117, 'commission pour l\'intallation de  a CABREL', 0, '2025/04/10', '2025-04-10 16:27:27', '2025-04-10 16:27:27'),
(118, 'Commission Miryam', 6000, '2025-04-10', '2025-04-10 17:27:44', '2025-04-10 17:27:44'),
(119, 'Abonnement à cabinet d\'avocat FOSSO KAMGA ASSOCIATE OFFICE (FK)', 20000, '2025-04-11', '2025-04-11 18:28:43', '2025-04-11 18:28:43'),
(120, 'Transport jaulmes jeudi et vendredi', 2000, '2025-04-11', '2025-04-11 18:32:30', '2025-04-11 18:32:30'),
(121, 'Transport Jaulmes', 1500, '2025-04-14', '2025-04-16 16:07:28', '2025-04-16 16:07:28'),
(122, 'TRANSPORT JAULMES semaine du 14 avril', 5000, '2025-04-15', '2025-04-17 23:23:19', '2025-04-17 23:23:19'),
(130, 'commission pour l\'intallation de  a Cabrel', 3025, '2025/04/21', '2025-04-21 13:13:41', '2025-04-21 13:13:41'),
(131, 'commission pour l\'intallation de  a Cabrel', 11950, '2025/04/21', '2025-04-21 15:18:07', '2025-04-21 15:18:07'),
(132, 'Transport et reliquat PV', 2000, '2025-04-21', '2025-04-21 15:20:19', '2025-04-21 15:20:19'),
(133, 'commission pour l\'intallation de  a MYRIAM', 0, '2025/04/25', '2025-04-25 12:53:16', '2025-04-25 12:53:16'),
(134, 'commission pour l\'intallation de  a Cabrel', 0, '2025/04/25', '2025-04-25 14:56:02', '2025-04-25 14:56:02'),
(135, 'commission pour l\'intallation de  a MYRIAM', 0, '2025/04/25', '2025-04-25 14:59:03', '2025-04-25 14:59:03'),
(136, 'commission pour l\'intallation de  a Faustin', 28950, '2025/05/06', '2025-05-06 14:55:45', '2025-05-06 14:55:45'),
(137, 'Transport achat', 8200, '2025-05-07', '2025-05-07 13:39:25', '2025-05-07 13:39:25'),
(138, 'Dividende Faustin', 75000, '2025-05-05', '2025-05-07 13:40:33', '2025-05-07 13:40:33'),
(139, 'Dividende Cabrel', 225000, '2025-05-05', '2025-05-07 13:41:11', '2025-05-07 13:41:11'),
(140, 'Commission et Main d\'œuvre Faustin', 30500, '2025-05-05', '2025-05-07 13:42:39', '2025-05-07 13:42:39'),
(141, 'Commission et Main d\'œuvre Cabrel', 30500, '2025-05-05', '2025-05-07 13:45:00', '2025-05-07 13:45:00'),
(142, 'RECHARGE BOX INTERNET ORANGE', 15000, '2025-05-07', '2025-05-08 12:23:14', '2025-05-08 12:23:14'),
(143, 'FRAIS DE RETRAIT OM CABREL', 3500, '2025-05-08', '2025-05-08 12:45:52', '2025-05-08 12:45:52'),
(144, 'PAIEMENT LOYER DE [JANVIER, FÉVRIER, MARS, AVRIL ]', 280000, '2025-05-08', '2025-05-09 10:41:54', '2025-05-09 10:41:54'),
(145, 'TRANSPORT MAURICE', 4118, '2025-05-09', '2025-05-09 11:43:49', '2025-05-09 11:43:49'),
(146, 'commission pour l\'intallation de  a CABREL', 0, '2025/05/10', '2025-05-10 18:27:34', '2025-05-10 18:27:34'),
(147, 'Avance dépannage convertisseurs (Marc)', 5000, '2025-05-10', '2025-05-10 18:30:58', '2025-05-10 18:30:58'),
(148, 'ACHAT téléphone huawei nova 2+; imei:- 864751039470177 - 864751039533537', 35000, '2025-05-10', '2025-05-10 18:34:31', '2025-05-10 18:34:31'),
(149, 'main d\'oeuvre maurice BOMONO(Mr Ekane)', 5000, '2025-05-10', '2025-05-10 18:36:06', '2025-05-10 18:36:06'),
(150, 'SALAIRE MYRIAM 10/05/2025', 47000, '2025-05-10', '2025-05-10 18:37:07', '2025-05-10 18:37:07'),
(151, 'FRAIS RETARAIT MYRIAM', 709, '2025-05-10', '2025-05-10 18:57:10', '2025-05-10 18:57:10'),
(152, 'FRAIS TRANSFERT+RETRAIT achat téléphone + transfert salaire myriam', 954, '2025-05-10', '2025-05-10 19:02:00', '2025-05-10 19:02:00'),
(153, 'commission pour l\'intallation de  a Faustin', 28950, '2025/05/12', '2025-05-12 10:48:33', '2025-05-12 10:48:33'),
(154, 'commission pour l\'intallation de  a Faustin', 0, '2025/05/13', '2025-05-13 16:59:57', '2025-05-13 16:59:57'),
(155, 'commission pour l\'intallation de  a Faustin', 0, '2025/05/13', '2025-05-13 17:12:34', '2025-05-13 17:12:34'),
(156, 'commission pour l\'intallation de  a CABREL', 0, '2025/05/19', '2025-05-19 10:36:09', '2025-05-19 10:36:09'),
(157, 'commission pour l\'intallation de  a CABREL', 0, '2025/05/19', '2025-05-19 11:02:55', '2025-05-19 11:02:55'),
(158, 'TRANSPORT INSTALLATION GHUISLAIN', 5200, '2025-05-18', '2025-05-19 12:41:01', '2025-05-19 12:41:01'),
(159, 'Transport', 4500, '2025-05-21', '2025-05-21 18:25:46', '2025-05-21 18:25:46'),
(160, 'commission pour l\'intallation de  a MYRIAM', 0, '2025/05/22', '2025-05-22 16:44:30', '2025-05-22 16:44:30'),
(161, 'commission pour l\'intallation de  a MYRIAM', 0, '2025/05/22', '2025-05-22 17:05:41', '2025-05-22 17:05:41'),
(162, 'commission pour l\'intallation de  a CABREL', 0, '2025/05/26', '2025-05-26 18:26:53', '2025-05-26 18:26:53'),
(163, 'commission pour l\'intallation de  a Cabrel', 0, '2025/06/02', '2025-06-02 15:30:49', '2025-06-02 15:30:49'),
(164, 'Recharge compte OM solergy pour DSF', 30000, '2025-05-28', '2025-06-02 15:33:55', '2025-06-02 15:33:55'),
(165, 'commission pour l\'intallation de  a MYRIAM', 0, '2025/06/05', '2025-06-05 14:56:31', '2025-06-05 14:56:31'),
(166, 'commission pour l\'intallation de  a MYRIAM', 0, '2025/06/05', '2025-06-05 15:04:17', '2025-06-05 15:04:17'),
(167, 'Bail juin', 70000, '2025-06-09', '2025-06-09 09:46:28', '2025-06-09 09:46:28'),
(168, 'Salaire +Commission Myriam Mai', 70400, '2025-06-11', '2025-06-11 13:57:16', '2025-06-11 13:57:16'),
(169, 'commission pour l\'intallation de 681623361 a CABREL', 0, '2025/06/13', '2025-06-13 13:27:11', '2025-06-13 13:27:11'),
(170, 'Frais de retrait OM', 4758, '2025-06-16', '2025-06-16 15:53:03', '2025-06-16 15:53:03'),
(171, 'Transport Jaulmes du 16/6', 5000, '2025-06-16', '2025-06-16 18:41:29', '2025-06-16 18:41:29'),
(172, 'Achat tokem énéo', 3100, '2025-06-13', '2025-06-17 17:10:11', '2025-06-17 17:10:11'),
(173, 'Transfert de MOMO Cabrel vers Espèce', 120000, '2025-06-17', '2025-06-17 17:11:58', '2025-06-17 17:11:58'),
(174, 'commission pour l\'intallation de  a Cabrel', 0, '2025/06/23', '2025-06-23 10:24:07', '2025-06-23 10:24:07'),
(175, 'commission pour l\'intallation de  a Cabrel', 0, '2025/06/23', '2025-06-23 10:42:48', '2025-06-23 10:42:48'),
(176, 'Achat clé a molette, expédition colis a bafoussame pour chantier banka, achat incesticide', 6500, '2025-06-24', '2025-06-24 15:39:50', '2025-06-24 15:39:50'),
(177, 'Commission Vistel pour vente deux pompe 110m et autre du 23/06/25', 247000, '2025-06-23', '2025-06-25 15:34:11', '2025-06-25 15:34:11'),
(178, 'Honoraires Maitre FOSSO NOE Pour Juin et juillet 25', 40600, '2025-06-25', '2025-06-25 15:35:39', '2025-06-25 15:35:39'),
(179, 'Transport achat du 26/06', 1000, '2025-06-26', '2025-06-26 15:14:12', '2025-06-26 15:14:12'),
(180, 'Transport achat materiel installation Mr LONLA (vistel, jp, faustin)', 5200, '2025-06-27', '2025-07-01 10:08:12', '2025-07-01 10:08:12'),
(190, 'Dividende Cabrel', 225000, '2025-07-04', '2025-07-04 19:43:23', '2025-07-04 19:43:23'),
(191, 'Dividende Faustin', 75000, '2025-07-04', '2025-07-04 19:43:54', '2025-07-04 19:43:54'),
(192, 'Commission et Prestation Cabrel', 172767, '2025-07-04', '2025-07-04 19:44:47', '2025-07-04 19:44:47'),
(193, 'Commission et Prestation Faustin', 129360, '2025-07-04', '2025-07-04 19:45:49', '2025-07-04 19:45:49'),
(194, 'Payement de l\'abonnement internet mois de juillet', 14900, '2025-07-07', '2025-07-07 11:00:39', '2025-07-07 11:00:39'),
(195, 'commission pour l\'intallation de  a CABREL', 0, '2025/07/08', '2025-07-08 14:14:33', '2025-07-08 14:14:33'),
(196, 'commission pour l\'intallation de  a CABREL', 0, '2025/07/08', '2025-07-08 14:18:53', '2025-07-08 14:18:53'),
(197, 'Salaire+Commission Myriam', 74240, '2025-07-10', '2025-07-10 11:31:53', '2025-07-10 11:31:53'),
(198, 'Loyer du mois de juin', 70000, '2025-07-10', '2025-07-10 11:32:35', '2025-07-10 11:32:35'),
(199, 'Avance Prestation Jaulmes', 100000, '2025-07-10', '2025-07-10 11:33:29', '2025-07-10 11:33:29'),
(200, 'Transport Achat PV et accessoires Installation Mr Ndjog', 7000, '2025-07-09', '2025-07-10 11:38:59', '2025-07-10 11:38:59'),
(208, 'commission pour l\'intallation de Essai verification a Faustin', 0, '2025/07/12', '2025-07-12 14:27:12', '2025-07-12 14:27:12'),
(209, 'commission pour l\'intallation de NDJOG a Faustin', 0, '2025/07/14', '2025-07-14 17:56:25', '2025-07-14 17:56:25'),
(210, 'Main d\'oeuvre Maurice Installation Japoma', 7500, '2025-07-11', '2025-07-14 18:01:45', '2025-07-14 18:01:45'),
(211, 'Rafraichissement et transport chantier Japoma', 9700, '2025-07-11', '2025-07-14 18:04:23', '2025-07-14 18:04:23'),
(212, 'Achat pionte tock', 1500, '2025-07-11', '2025-07-14 18:06:22', '2025-07-14 18:06:22'),
(213, 'Dépot compte access', 100000, '2025-07-15', '2025-07-17 12:18:22', '2025-07-17 12:18:22'),
(214, 'commission pour l\'intallation de  a MYRIAM', 0, '2025/07/18', '2025-07-18 13:44:30', '2025-07-18 13:44:30'),
(215, 'commission pour l\'intallation de  a Faustin', 0, '2025/07/19', '2025-07-19 09:53:28', '2025-07-19 09:53:28'),
(216, 'Transport materiel et personnel allé pour installation schang', 19000, '2025-07-18', '2025-07-19 10:48:36', '2025-07-19 10:48:36'),
(217, 'commission pour l\'intallation de EWANE a Faustin', 0, '2025/07/19', '2025-07-19 11:10:23', '2025-07-19 11:10:23'),
(218, 'commission pour l\'intallation de  a Cabrel', 0, '2025/07/19', '2025-07-19 19:24:40', '2025-07-19 19:24:40'),
(219, 'Transport livraison batterie 150Ah', 1000, '2025-07-19', '2025-07-21 16:29:21', '2025-07-21 16:29:21'),
(220, 'Transport colis pour expédition a youndé par général', 16000, '2025-07-19', '2025-07-21 16:30:35', '2025-07-21 16:30:35'),
(221, 'Transport achat', 1000, '2025-07-21', '2025-07-21 16:47:54', '2025-07-21 16:47:54'),
(222, 'commission pour l\'intallation de Mr TICHA a Cabrel', 0, '2025/07/21', '2025-07-21 17:23:31', '2025-07-21 17:23:31'),
(223, 'Mèche pour perceuse', 5000, '2025-07-02', '2025-07-22 14:41:55', '2025-07-22 14:41:55'),
(224, 'Transport achat materiel Madame Kélly', 3500, '2025-07-22', '2025-07-22 14:43:24', '2025-07-22 14:43:24'),
(225, 'Transport pour yaoundé Eyang', 29500, '2025-07-22', '2025-07-30 12:52:46', '2025-07-30 12:52:46'),
(226, 'Taxi pv pour bureau et bureau pour agence', 5000, '2025-07-22', '2025-07-30 12:54:09', '2025-07-30 12:54:09'),
(227, 'Prestation technicien', 13000, '2025-07-23', '2025-07-30 12:54:57', '2025-07-30 12:54:57'),
(228, 'Nutrition Eyang', 4000, '2025-07-23', '2025-07-30 12:55:41', '2025-07-30 12:55:41'),
(229, 'commission pour l\'intallation de  a Cabrel', 0, '2025/07/31', '2025-07-31 12:19:40', '2025-07-31 12:19:40'),
(230, 'commission pour l\'intallation de  a Faustin', 0, '2025/08/02', '2025-08-02 12:50:26', '2025-08-02 12:50:26'),
(231, 'Transport tuyaux solergy-chefferie Mbanya', 1500, '2025-08-04', '2025-08-05 10:36:47', '2025-08-05 10:36:47'),
(232, 'Remboursement dette Faustin (relicat achat de lampe+controleur 60A))', 3000, '2025-08-04', '2025-08-05 10:39:10', '2025-08-05 10:39:10'),
(233, 'Transport achat tuyau et recherche convertisseur 1000W pure sinus', 2400, '2025-08-04', '2025-08-05 10:40:33', '2025-08-05 10:40:33'),
(234, 'Transport Jaulmes', 1000, '2025-08-04', '2025-08-05 10:41:15', '2025-08-05 10:41:15'),
(235, 'Dividende Cabrel', 225000, '2025-08-05', '2025-08-05 10:46:59', '2025-08-05 10:46:59'),
(236, 'Dividende Faustin', 75000, '2025-08-05', '2025-08-05 10:47:32', '2025-08-05 10:47:32'),
(237, 'Salaire Faustin', 60000, '2025-08-05', '2025-08-05 10:48:00', '2025-08-05 10:48:00'),
(238, 'Commission et prestation Cabrel', 145900, '2025-08-05', '2025-08-05 10:50:13', '2025-08-05 10:50:13'),
(239, 'Commission et prestation Faustin', 100650, '2025-08-05', '2025-08-05 10:50:59', '2025-08-05 10:50:59'),
(240, 'commission pour l\'intallation de  a Cabrel', 0, '2025/08/07', '2025-08-07 15:44:33', '2025-08-07 15:44:33'),
(241, 'Transport batterie et achat Sédar', 3200, '2025-08-07', '2025-08-07 15:48:54', '2025-08-07 15:48:54'),
(242, 'commission pour l\'intallation de FERME PITI a Faustin', 0, '2025/08/12', '2025-08-12 07:38:20', '2025-08-12 07:38:20'),
(243, 'commission pour l\'intallation de GABAIN KENFACK a Faustin', 0, '2025/08/12', '2025-08-12 08:03:02', '2025-08-12 08:03:02'),
(244, 'Salaire Myriam Juillet', 92500, '2025-08-11', '2025-08-12 08:05:40', '2025-08-12 08:05:40'),
(245, 'Transport Panneaux pour général bpd', 6500, '2025-08-11', '2025-08-12 08:07:24', '2025-08-12 08:07:24'),
(246, 'Raffraichiment', 1500, '2025-08-11', '2025-08-12 08:07:51', '2025-08-12 08:07:51'),
(247, 'Transport achat cable', 500, '2025-08-11', '2025-08-12 08:08:29', '2025-08-12 08:08:29'),
(248, 'Transport achat meplat et flotteur', 750, '2025-08-12', '2025-08-12 09:26:11', '2025-08-12 09:26:11'),
(249, 'commission pour l\'intallation de  a MYRIAM', 0, '2025/08/13', '2025-08-13 13:47:39', '2025-08-13 13:47:39'),
(250, 'prestation Fokou herman 110m Dschang', 50000, '2025-08-12', '2025-08-14 18:17:24', '2025-08-14 18:17:24'),
(251, 'transport total Mapubi', 9800, '2025-08-12', '2025-08-14 18:33:28', '2025-08-14 18:33:28'),
(252, 'nutrition Mapubi: alle1500-retour5750', 7250, '2025-08-12', '2025-08-14 18:35:31', '2025-08-14 18:35:31'),
(253, 'achat testeur de billet+transport', 3700, '2025-08-14', '2025-08-14 18:37:46', '2025-08-14 18:37:46'),
(254, 'commission pour l\'intallation de  a MYRIAM', 0, '2025/08/27', '2025-08-27 14:43:29', '2025-08-27 14:43:29'),
(255, 'commission pour l\'intallation de  a MYRIAM', 0, '2025/08/29', '2025-08-29 17:13:30', '2025-08-29 17:13:30'),
(256, 'commission pour l\'intallation de  a MYRIAM', 0, '2025/08/29', '2025-08-29 17:26:52', '2025-08-29 17:26:52'),
(257, 'commission pour l\'intallation de  a MYRIAM', 0, '2025/09/01', '2025-09-01 12:31:53', '2025-09-01 12:31:53'),
(258, 'achat echelle telescopique 12 marches TOTAL', 76500, '2025-09-01', '2025-09-01 12:54:53', '2025-09-01 12:54:53'),
(259, 'Achat téléphone solergy REDMI A5', 47000, '2025-09-04', '2025-09-04 15:33:31', '2025-09-04 15:33:31'),
(260, 'Retrait Convertisseur joe cargo', 65650, '2025-09-04', '2025-09-04 15:34:23', '2025-09-04 15:34:23'),
(261, 'Transport achat Téléphone et retrait convertisseur', 1800, '2025-09-04', '2025-09-04 15:35:14', '2025-09-04 15:35:14'),
(262, 'Dividende Cabrel', 225000, '2025-09-04', '2025-09-04 19:20:43', '2025-09-04 19:20:43'),
(263, 'Dividende Faustin', 75000, '2025-09-04', '2025-09-04 19:21:45', '2025-09-04 19:21:45'),
(264, 'Commission Cabrel', 40580, '2025-09-04', '2025-09-04 19:22:27', '2025-09-04 19:22:27'),
(265, 'Commission Faustin', 30000, '2025-09-04', '2025-09-04 19:22:56', '2025-09-04 19:22:56'),
(266, 'Prestation Cabrel', 40000, '2025-09-04', '2025-09-04 19:23:30', '2025-09-04 19:23:30'),
(267, 'Prestation Faustin', 10000, '2025-09-04', '2025-09-04 19:24:16', '2025-09-04 19:24:16'),
(268, 'Recharge box orange', 15000, '2025-09-05', '2025-09-05 14:01:14', '2025-09-05 14:01:14'),
(269, 'Achat deux Cadenas', 2000, '2025-09-06', '2025-09-10 11:34:15', '2025-09-10 11:34:15'),
(270, 'Transport achat Cadenas', 600, '2025-09-06', '2025-09-10 11:34:50', '2025-09-10 11:34:50'),
(271, 'Transport avance batterie mr ngongang', 1800, '2025-09-09', '2025-09-10 11:35:41', '2025-09-10 11:35:41'),
(272, 'Salaire Myriam', 76550, '2025-09-10', '2025-09-10 11:36:16', '2025-09-10 11:36:16'),
(273, 'commission pour l\'intallation de BANA 105 000 a Cabrel', 0, '2025/09/10', '2025-09-10 13:57:38', '2025-09-10 13:57:38'),
(274, 'Loyer du mois de aout', 70000, '2025-09-10', '2025-09-10 15:03:14', '2025-09-10 15:03:14'),
(275, 'Support  armoire', 1500, '2025-09-19', '2025-09-19 16:05:02', '2025-09-19 16:05:02'),
(276, 'Rouleau pinceau', 1000, '2025-09-19', '2025-09-19 16:05:42', '2025-09-19 16:05:42'),
(277, 'Diluant', 1000, '2025-09-19', '2025-09-19 16:06:08', '2025-09-19 16:06:08'),
(278, 'Transport', 600, '2025-09-19', '2025-09-19 16:07:05', '2025-09-19 16:07:05'),
(279, 'Transport et nutrition installation Bakassa', 10000, '2025-09-13', '2025-09-19 16:08:06', '2025-09-19 16:08:06'),
(280, 'Transport et rafraichissement installation Mr ngongang bonaberie', 3200, '2025-09-18', '2025-09-19 16:09:49', '2025-09-19 16:09:49'),
(281, 'commission pour l\'intallation de Mr Ngongang a Faustin', 0, '2025/09/19', '2025-09-19 16:53:45', '2025-09-19 16:53:45'),
(282, 'Transport nyalla Cambo', 2000, '2025-09-29', '2025-09-30 10:08:36', '2025-09-30 10:08:36'),
(283, 'commission pour l\'intallation de  a Faustin', 0, '2025/10/08', '2025-10-08 13:08:52', '2025-10-08 13:08:52'),
(284, 'Salaire et Commission Cabrel', 247000, '2025-10-07', '2025-10-08 13:13:36', '2025-10-08 13:13:36'),
(285, 'Conseiller Juridique', 50000, '2025-10-08', '2025-10-08 13:14:40', '2025-10-08 13:14:40'),
(286, 'Transport materiel ghislain, achat tuyau,conseille ,mr ngongang', 6000, '2025-10-08', '2025-10-08 13:21:03', '2025-10-08 13:21:03'),
(287, 'Recharge box', 15000, '2025-10-06', '2025-10-08 13:21:52', '2025-10-08 13:21:52'),
(288, 'commission pour l\'intallation de Mr Cyril Bouda a Faustin', 0, '2025/10/10', '2025-10-10 17:59:50', '2025-10-10 17:59:50'),
(289, 'Salaire Myriam', 54000, '2025-10-10', '2025-10-10 18:02:53', '2025-10-10 18:02:53'),
(290, 'Dividende et commission faustin', 166100, '2025-10-10', '2025-10-10 18:05:31', '2025-10-10 18:05:31'),
(291, 'Salaire faustin', 60000, '2025-10-10', '2025-10-10 18:06:09', '2025-10-10 18:06:09'),
(292, 'commission pour l\'intallation de  a MYRIAM', 0, '2025/11/08', '2025-11-08 08:53:28', '2025-11-08 08:53:28'),
(293, 'Dividende Cabrel', 225000, '2025-11-01', '2025-11-17 17:53:03', '2025-11-17 17:53:03'),
(294, 'Dividende Faustin', 75000, '2025-11-01', '2025-11-17 17:53:37', '2025-11-17 17:53:37'),
(295, 'Commission et prestation Cabrel', 30400, '2025-11-01', '2025-11-17 17:55:14', '2025-11-17 17:55:14'),
(296, 'Commission et prestation Faustin', 86500, '2025-11-01', '2025-11-17 17:56:01', '2025-11-17 17:56:01'),
(297, 'Décharge collie pompes jfi et transport', 95000, '2025-11-08', '2025-11-17 17:57:28', '2025-11-17 17:57:28'),
(298, 'Salaire et commission myriam', 87180, '2025-11-10', '2025-11-17 17:58:15', '2025-11-17 17:58:15'),
(299, 'Transport et expedition colis pour foumbane et koutaba', 11200, '2025-11-17', '2025-11-17 18:00:55', '2025-11-17 18:00:55'),
(300, 'commission pour l\'intallation de  a MYRIAM', 0, '2025/11/17', '2025-11-17 18:07:54', '2025-11-17 18:07:54'),
(301, 'commission pour l\'intallation de 699376791 a faustin', 0, '2025/11/17', '2025-11-17 18:11:36', '2025-11-17 18:11:36'),
(302, 'GESTION DE IGS', 20000, '2025-11-16', '2025-11-17 18:12:51', '2025-11-17 18:12:51'),
(303, 'commission pour l\'intallation de  a Faustin', 0, '2025/11/25', '2025-11-25 10:01:28', '2025-11-25 10:01:28');

-- --------------------------------------------------------

--
-- Structure de la table `charge_details`
--

CREATE TABLE `charge_details` (
  `id` bigint(20) UNSIGNED NOT NULL,
  `titre` varchar(255) DEFAULT NULL,
  `detail` varchar(255) DEFAULT NULL,
  `date` varchar(255) DEFAULT NULL,
  `montant` varchar(255) NOT NULL,
  `charge_id` varchar(255) NOT NULL,
  `created_at` timestamp NULL DEFAULT NULL,
  `updated_at` timestamp NULL DEFAULT NULL
) ENGINE=InnoDB DEFAULT CHARSET=utf8mb4 COLLATE=utf8mb4_unicode_ci;

--
-- Déchargement des données de la table `charge_details`
--

INSERT INTO `charge_details` (`id`, `titre`, `detail`, `date`, `montant`, `charge_id`, `created_at`, `updated_at`) VALUES
(6, 'o', 'o', '2024-07-26', '0', '13', '2024-07-26 20:13:20', '2024-07-26 20:13:20'),
(7, 'o', 'o', '2024-07-12', '0', '6', '2024-07-28 13:39:32', '2024-07-28 13:39:32'),
(8, 'INSTALLATION SEDAR FAUSTIN', 'frais de main d\'oeuvre', '2024-11-06', '5000', '37', '2024-11-07 11:33:47', '2024-11-07 11:33:47'),
(9, 'INSTALLATION SEDAR cabrel', 'FAUSTIN 5000\nCABREL 5000', '2024-11-06', '0', '37', '2024-11-07 11:35:15', '2024-11-07 11:35:15');

-- --------------------------------------------------------

--
-- Structure de la table `clients`
--

CREATE TABLE `clients` (
  `id` bigint(20) UNSIGNED NOT NULL,
  `numero` varchar(255) NOT NULL,
  `nom` varchar(255) NOT NULL,
  `email` varchar(255) DEFAULT NULL,
  `adresse` varchar(255) DEFAULT NULL,
  `created_at` timestamp NULL DEFAULT NULL,
  `updated_at` timestamp NULL DEFAULT NULL
) ENGINE=InnoDB DEFAULT CHARSET=utf8mb4 COLLATE=utf8mb4_unicode_ci;

--
-- Déchargement des données de la table `clients`
--

INSERT INTO `clients` (`id`, `numero`, `nom`, `email`, `adresse`, `created_at`, `updated_at`) VALUES
(35, '1', 'A', NULL, NULL, '2024-06-25 14:55:03', '2024-06-25 14:55:03'),
(36, '676033780', 'SIMO (BAILLEUR bénédicte)', NULL, NULL, '2024-07-09 12:00:26', '2024-07-09 12:00:26'),
(37, '682827181', 'Mr TICHA NDANGOH', NULL, NULL, '2024-07-23 10:05:10', '2024-07-23 10:05:10'),
(38, '656622427', 'NDONO ATANGANA', NULL, NULL, '2024-07-30 13:39:14', '2024-07-30 13:39:14'),
(39, '656512068', 'client joseph 320000', NULL, NULL, '2024-07-31 17:07:43', '2024-07-31 17:07:43'),
(40, '679978721', 'GOD-YANG Laurent', NULL, NULL, '2024-08-01 16:28:14', '2024-08-01 16:28:14'),
(41, '0', 'test', NULL, NULL, '2024-08-03 07:19:57', '2024-08-03 07:19:57'),
(42, '677553159', 'AURELIEN', NULL, NULL, '2024-09-16 08:08:11', '2024-09-16 08:08:11'),
(43, '681581553', 'Paroisse Saint Augustin', NULL, NULL, '2024-09-19 11:57:30', '2024-09-19 11:57:30'),
(44, '657211753', 'Mr JACK ABDOULADOUM', NULL, NULL, '2024-10-04 08:52:18', '2024-10-04 08:52:18'),
(45, '693282783', 'MIBATKE PAUL', NULL, NULL, '2024-10-05 09:53:55', '2024-10-05 09:53:55'),
(46, '696253158', 'JEAN MARC', NULL, NULL, '2024-10-06 09:21:52', '2024-10-06 09:21:52'),
(47, '657248925', 'LIWANDI EMMANUEL', NULL, NULL, '2024-11-02 16:34:39', '2024-11-02 16:34:39'),
(48, '697897033', 'Lycee bilingue de MELONG', NULL, NULL, '2024-11-04 15:26:46', '2024-11-04 15:26:46'),
(49, '683161309', 'nzoko constant', NULL, NULL, '2024-11-05 08:41:15', '2024-11-05 08:41:15'),
(50, '681623361', '681623361', NULL, NULL, '2024-11-05 16:18:20', '2024-11-05 16:18:20'),
(51, '690516510', '690516510', NULL, NULL, '2024-11-05 16:37:47', '2024-11-05 16:37:47'),
(52, '1234', 'client soir 07/11/2024', NULL, NULL, '2024-11-07 17:54:46', '2024-11-07 17:54:46'),
(53, '696253158', 'mr DIDIER SHOP', NULL, NULL, '2024-11-13 17:35:43', '2024-11-13 17:35:43'),
(54, '696253158', 'mr DIDIER SHOP', NULL, NULL, '2024-11-13 17:36:52', '2024-11-13 17:36:52'),
(55, '697897033', 'Innocent', NULL, NULL, '2024-11-20 16:12:47', '2024-11-20 16:12:47'),
(56, '697291703', 'OTILE', NULL, NULL, '2024-11-20 16:15:45', '2024-11-20 16:15:45'),
(57, '697897033', 'Technicien PK21', NULL, NULL, '2024-11-30 16:28:23', '2024-11-30 16:28:23'),
(58, '697897033', 'MACHIA LAMINE', NULL, NULL, '2024-11-30 16:35:12', '2024-11-30 16:35:12'),
(59, '670707662', 'MR DIBADJOU', NULL, NULL, '2024-12-10 17:34:36', '2024-12-10 17:34:36'),
(60, '679985013', 'MR LEBOMO MEDARD', NULL, NULL, '2024-12-12 16:26:57', '2024-12-12 16:26:57'),
(61, '679985013', 'MR LEBOMO MEDARD', NULL, NULL, '2024-12-12 17:19:50', '2024-12-12 17:19:50'),
(62, '699363638', 'Mme TONYE ROSALIE', NULL, NULL, '2024-12-13 18:25:11', '2024-12-13 18:25:11'),
(63, '699652281', 'MR OUSSOUMANOU', NULL, NULL, '2024-12-19 14:19:16', '2024-12-19 14:19:16'),
(64, '690572481', 'mme DJEUKAM LINE', NULL, NULL, '2024-12-31 10:55:30', '2024-12-31 10:55:30'),
(65, '693108065', 'mr YOKORO JEAN VALERE', NULL, NULL, '2024-12-31 11:20:53', '2024-12-31 11:20:53'),
(66, '2356789', 'fioie', NULL, NULL, '2025-01-02 12:02:31', '2025-01-02 12:02:31'),
(67, '2356789', 'fioie', NULL, NULL, '2025-01-02 12:04:20', '2025-01-02 12:04:20'),
(68, '2356789', 'fioie', NULL, NULL, '2025-01-02 12:04:37', '2025-01-02 12:04:37'),
(69, '2356789', 'fioie', NULL, NULL, '2025-01-02 12:06:37', '2025-01-02 12:06:37'),
(70, '677873459', 'MR BERTRAND', NULL, NULL, '2025-01-14 17:12:04', '2025-01-14 17:12:04'),
(71, '699652281', 'MR OUSSOUMANOU', NULL, NULL, '2025-01-15 09:48:50', '2025-01-15 09:48:50'),
(72, '699652281', 'MR OUSSOUMANOU', NULL, NULL, '2025-01-15 09:50:49', '2025-01-15 09:50:49'),
(73, '699652281', 'MR OUSSOUMANOU', NULL, NULL, '2025-01-15 10:39:26', '2025-01-15 10:39:26'),
(74, '677873459', 'BERTRAND', NULL, NULL, '2025-01-18 14:17:11', '2025-01-18 14:17:11'),
(75, '680872143', 'mr GERALD NJIE', NULL, NULL, '2025-01-27 14:16:27', '2025-01-27 14:16:27'),
(76, '651184624', 'SIEKO', NULL, NULL, '2025-01-27 16:57:40', '2025-01-27 16:57:40'),
(77, '6', 'ATOH STANLE', NULL, NULL, '2025-01-28 15:43:46', '2025-01-28 15:43:46'),
(78, '651184624', 'SIEKO', NULL, NULL, '2025-01-28 15:55:26', '2025-01-28 15:55:26'),
(79, '679162468', 'MR FOMBOU FIDELE', NULL, NULL, '2025-02-04 10:53:55', '2025-02-04 10:53:55'),
(80, '69885092', 'Nyalla entrée école', NULL, NULL, '2025-02-04 10:57:21', '2025-02-04 10:57:21'),
(81, '677551322', 'Mr RUBIEL', NULL, NULL, '2025-02-04 11:06:14', '2025-02-04 11:06:14'),
(82, '699438410', 'ABBE NDJEWELL HONGLA GHISLAIN', NULL, NULL, '2025-02-06 15:12:09', '2025-02-06 15:12:09'),
(83, '699438410', 'ABBE NDJEWELL HONGLA GHISLAIN', NULL, NULL, '2025-02-06 15:13:52', '2025-02-06 15:13:52'),
(84, '689756078', 'EFFICIENCE PLUS SERVICES SARL', NULL, NULL, '2025-02-08 10:23:03', '2025-02-08 10:23:03'),
(85, '689756078', 'EFFICIENCE PLUS SERVICES SARL', NULL, NULL, '2025-02-08 10:29:22', '2025-02-08 10:29:22'),
(86, '678613890', 'madame zenabou', NULL, NULL, '2025-02-14 16:13:53', '2025-02-14 16:13:53'),
(87, '690716027', 'CLIENT DE BOMONO', NULL, NULL, '2025-02-15 17:25:46', '2025-02-15 17:25:46'),
(88, '670828231', 'client', NULL, NULL, '2025-02-15 17:30:05', '2025-02-15 17:30:05'),
(89, '671327778', 'SEDAR', NULL, NULL, '2025-02-15 18:55:15', '2025-02-15 18:55:15'),
(90, '0', '0', NULL, NULL, '2025-02-16 20:35:36', '2025-02-16 20:35:36'),
(91, '0', '0', NULL, NULL, '2025-02-16 21:22:23', '2025-02-16 21:22:23'),
(92, '0', '0', NULL, NULL, '2025-02-16 21:46:26', '2025-02-16 21:46:26'),
(93, '670212791', 'MR AMOUGOU FABIEN 2', NULL, NULL, '2025-02-18 09:06:50', '2025-02-18 09:06:50'),
(94, '670212791', 'MR AMOUGOU FABIEN 2', NULL, NULL, '2025-02-18 11:38:49', '2025-02-18 11:38:49'),
(95, '671327778', 'SEDAR', NULL, NULL, '2025-02-18 14:58:14', '2025-02-18 14:58:14'),
(96, '651195631', 'mr youssouf abdullahi', NULL, NULL, '2025-02-18 16:02:51', '2025-02-18 16:02:51'),
(97, '698196880', 'MR KANPOETE ADAMOU', NULL, NULL, '2025-02-19 16:07:25', '2025-02-19 16:07:25'),
(98, '698430291', 'MR ABDOULAYE MALIKI', NULL, NULL, '2025-02-22 08:57:48', '2025-02-22 08:57:48'),
(99, '693619292', 'MR HASSAN', NULL, NULL, '2025-03-01 08:53:58', '2025-03-01 08:53:58'),
(100, '698771588', 'Mr. NGONGANG', NULL, NULL, '2025-03-05 09:45:25', '2025-03-05 09:45:25'),
(101, '653382945', 'TAMO GUEKO YVES', NULL, NULL, '2025-03-14 17:35:21', '2025-03-14 17:35:21'),
(102, '653382945', 'TAMO GUEKO YVES', NULL, NULL, '2025-03-14 17:42:08', '2025-03-14 17:42:08'),
(103, '680747547', 'JOEL', NULL, NULL, '2025-03-16 13:05:52', '2025-03-16 13:05:52'),
(104, '691525065', 'DIMITRI KETCHOUNG', NULL, NULL, '2025-03-19 11:01:33', '2025-03-19 11:01:33'),
(105, '694211613', 'mr houmarou sanda', NULL, NULL, '2025-03-22 08:50:35', '2025-03-22 08:50:35'),
(106, '697904059', '677746309 BOUMNYEBEL', NULL, NULL, '2025-03-25 17:29:15', '2025-03-25 17:29:15'),
(107, '676284025', 'MR NGANGUE BEYISSA ELIE', NULL, NULL, '2025-03-29 10:10:33', '2025-03-29 10:10:33'),
(108, '676284025', 'MR NGANGUE BEYISSA ELIE', NULL, NULL, '2025-03-29 10:13:25', '2025-03-29 10:13:25'),
(109, '682635680', 'Mme ornella', NULL, NULL, '2025-04-05 14:44:00', '2025-04-05 14:44:00'),
(110, '698422012', 'mr assen alain', NULL, NULL, '2025-04-10 13:31:38', '2025-04-10 13:31:38'),
(111, '671179114', 'GRAND SOUCI ELECTRIQUE (GILDAS)', NULL, NULL, '2025-04-11 05:31:51', '2025-04-11 05:31:51'),
(112, '696289778', 'Lejou', 'solutionssolergy@gmail.com', 'Mosquée, Bafoussam', '2025-04-15 10:28:04', '2025-04-15 10:28:04'),
(113, '655552284', 'mr manga sinon parfait', NULL, NULL, '2025-04-19 17:15:21', '2025-04-19 17:15:21'),
(120, '655146238', 'KAMAHA Séraphin', NULL, NULL, '2025-04-21 13:13:41', '2025-04-21 13:13:41'),
(121, '677862678', 'Mr.FOYET JULES', NULL, NULL, '2025-04-21 13:48:01', '2025-04-21 13:48:01'),
(122, '657583677', 'Mr.NGUETSA B', NULL, NULL, '2025-04-21 15:18:07', '2025-04-21 15:18:07'),
(123, '6898090', 'client', NULL, NULL, '2025-04-21 17:45:26', '2025-04-21 17:45:26'),
(124, '6898090', 'client', NULL, NULL, '2025-04-21 17:47:37', '2025-04-21 17:47:37'),
(125, '699740347', 'Mme SELLE NGOH', NULL, NULL, '2025-04-22 14:27:58', '2025-04-22 14:27:58'),
(126, '677829958', 'Yaoundé', NULL, NULL, '2025-04-22 17:12:10', '2025-04-22 17:12:10'),
(127, '677829958', 'Yaoundé', NULL, NULL, '2025-04-22 18:32:26', '2025-04-22 18:32:26'),
(128, '677829958', 'Yaoundé', NULL, NULL, '2025-04-22 18:39:21', '2025-04-22 18:39:21'),
(129, '656903390', 'Mr negro', NULL, NULL, '2025-04-25 14:56:02', '2025-04-25 14:56:02'),
(130, '699888995', 'MR AYISSI jean etienne', NULL, NULL, '2025-04-25 14:59:03', '2025-04-25 14:59:03'),
(131, '699733717', 'DESIGN\'ARCH & INTERIOR', NULL, NULL, '2025-04-28 11:19:30', '2025-04-28 11:19:30'),
(132, '33749165513', '(33)749165513 BONEPOUPA', NULL, NULL, '2025-04-28 11:55:24', '2025-04-28 11:55:24'),
(133, '655286633', 'mme laurette', NULL, NULL, '2025-04-30 14:47:37', '2025-04-30 14:47:37'),
(134, '694492160', 'NGAMO KAMENI BERNARD', NULL, NULL, '2025-05-06 14:55:45', '2025-05-06 14:55:45'),
(135, '656903390', 'Mr. NEGRO', NULL, NULL, '2025-05-07 14:50:46', '2025-05-07 14:50:46'),
(136, '656903390', 'Mr. NEGRO', NULL, NULL, '2025-05-07 15:12:27', '2025-05-07 15:12:27'),
(137, '694955476', 'Mr DANIEL MOLUH', 'solutionssolergy@gmail.com', 'FACE ENTRÉE COLLÈGE BÉNÉDICTE', '2025-05-09 14:20:56', '2025-05-09 14:20:56'),
(138, '656738596', 'Mr EKANE honoré', NULL, NULL, '2025-05-10 18:27:34', '2025-05-10 18:27:34'),
(139, '694492160', 'Mr NGAMO KAMENI', NULL, NULL, '2025-05-12 10:48:33', '2025-05-12 10:48:33'),
(140, '656994491', 'MOUSSA MOHAMAN', NULL, NULL, '2025-05-13 16:59:57', '2025-05-13 16:59:57'),
(141, '656994491', 'MOUSSA MOHAMAN', NULL, NULL, '2025-05-13 17:12:34', '2025-05-13 17:12:34'),
(142, '621707968', 'GHISLAIN', NULL, NULL, '2025-05-15 08:19:21', '2025-05-15 08:19:21'),
(143, '672882483', 'PAULIONEL', NULL, NULL, '2025-05-21 08:57:07', '2025-05-21 08:57:07'),
(144, '694634700', 'Mr MVOGO JEAN CLAUDE', NULL, NULL, '2025-05-21 12:18:17', '2025-05-21 12:18:17'),
(145, '677391851', 'MR PAPGOUO FOREST', NULL, NULL, '2025-05-21 13:21:47', '2025-05-21 13:21:47'),
(146, '677629718', '677629718 HOTEL', NULL, NULL, '2025-05-21 13:56:41', '2025-05-21 13:56:41'),
(147, '697829430', 'MR MELI JOEL', NULL, NULL, '2025-05-22 17:05:41', '2025-05-22 17:05:41'),
(148, '698771588', 'Mr Ngogang', NULL, NULL, '2025-05-26 17:53:26', '2025-05-26 17:53:26'),
(149, '677553159', 'AURELIEN', NULL, NULL, '2025-05-26 18:50:03', '2025-05-26 18:50:03'),
(150, '677551322', 'Mr. RUBIEL DALLENGOUNDO', NULL, NULL, '2025-05-28 16:21:36', '2025-05-28 16:21:36'),
(151, '693223459', '693223459', NULL, NULL, '2025-06-02 12:08:54', '2025-06-02 12:08:54'),
(152, '33670002366', 'Mr.OLIVIER', NULL, NULL, '2025-06-02 12:27:20', '2025-06-02 12:27:20'),
(153, '690627141', 'Mr. FABRICE', NULL, NULL, '2025-06-02 15:30:49', '2025-06-02 15:30:49'),
(154, '652491030', 'RESIDENCE 652491030 (petrolex bonaberi)', NULL, NULL, '2025-06-02 17:25:25', '2025-06-02 17:25:25'),
(155, '23672122324', '23672122324', NULL, NULL, '2025-06-03 12:53:21', '2025-06-03 12:53:21'),
(156, '698948217', '698948217', NULL, NULL, '2025-06-03 14:56:23', '2025-06-03 14:56:23'),
(157, '697080721', 'mr NKALA', NULL, NULL, '2025-06-05 14:56:31', '2025-06-05 14:56:31'),
(158, '697080721', 'mr NKALA', NULL, NULL, '2025-06-05 15:04:17', '2025-06-05 15:04:17'),
(159, '694563334', 'TECNICIEN KAMENI LOUIS', NULL, NULL, '2025-06-05 15:11:48', '2025-06-05 15:11:48'),
(160, '652491030', 'MR TATANG', NULL, NULL, '2025-06-05 16:08:25', '2025-06-05 16:08:25'),
(161, '658826309', 'TANCHEDA', NULL, NULL, '2025-06-09 12:38:37', '2025-06-09 12:38:37'),
(162, '656021214', '+237 656021214', NULL, NULL, '2025-06-10 16:06:15', '2025-06-10 16:06:15'),
(163, '675075328', 'MR MOMHA PAUL', NULL, NULL, '2025-06-13 15:30:07', '2025-06-13 15:30:07'),
(164, '696858545', '696858545', NULL, NULL, '2025-06-17 13:51:42', '2025-06-17 13:51:42'),
(165, '696858545', '696858545', NULL, NULL, '2025-06-18 18:27:56', '2025-06-18 18:27:56'),
(166, '696858545', '696858545', NULL, NULL, '2025-06-18 18:42:55', '2025-06-18 18:42:55'),
(167, '670828231', 'technicien', NULL, NULL, '2025-06-20 14:15:07', '2025-06-20 14:15:07'),
(168, '693287544', 'OMEGA SERVICE PLUS', NULL, NULL, '2025-06-23 10:24:07', '2025-06-23 10:24:07'),
(169, '693287544', 'OMEGA SERVICE PLUS GUINEE EQUATORIALE', NULL, NULL, '2025-06-23 10:42:48', '2025-06-23 10:42:48'),
(170, '675070913', 'voisine sophie', NULL, NULL, '2025-06-23 12:17:02', '2025-06-23 12:17:02'),
(171, '674750851', 'MR TABOU ELVIS', NULL, NULL, '2025-06-23 16:59:31', '2025-06-23 16:59:31'),
(172, '679159645', 'Feussi Takam Ghislain', NULL, 'Obala', '2025-06-23 18:02:32', '2025-06-23 18:02:32'),
(173, '697234617', '697234617', NULL, NULL, '2025-06-24 14:54:32', '2025-06-24 14:54:32'),
(174, '699733826', '699733826', NULL, NULL, '2025-06-24 15:14:00', '2025-06-24 15:14:00'),
(175, '670520203', 'ASSONG', NULL, NULL, '2025-06-25 09:40:37', '2025-06-25 09:40:37'),
(176, '670828231', 'clients', NULL, NULL, '2025-06-27 14:09:35', '2025-06-27 14:09:35'),
(177, '696039434', 'Mahmoudou', NULL, 'Zokok. Face prison.Maroua', '2025-06-29 03:41:21', '2025-06-29 03:41:21'),
(187, '697367793', '697367793', NULL, NULL, '2025-07-04 16:02:15', '2025-07-04 16:02:15'),
(188, '696988739', '696988739', NULL, NULL, '2025-07-04 17:16:08', '2025-07-04 17:16:08'),
(189, '676937284', '676937284', NULL, NULL, '2025-07-07 09:22:18', '2025-07-07 09:22:18'),
(190, '693308466', '693308466', NULL, NULL, '2025-07-09 18:02:13', '2025-07-09 18:02:13'),
(191, '697206458', 'Noah', NULL, 'Awae escalier, Yaoundé', '2025-07-10 03:45:07', '2025-07-10 03:45:07'),
(195, '697367793', 'NDJOG', NULL, NULL, '2025-07-10 17:57:38', '2025-07-10 17:57:38'),
(196, '693308466', 'AVJ CONSTRUCTION AND PARTNERS', NULL, NULL, '2025-07-10 18:10:51', '2025-07-10 18:10:51'),
(197, '698198338', 'DAAWE KAÏSSOU CHRISTIAN', 'lorddaawe@yahoo.fr', 'YAGOUA', '2025-07-10 20:15:05', '2025-07-10 20:15:05'),
(202, '697897033', 'Essaie vérification', NULL, NULL, '2025-07-12 13:57:13', '2025-07-12 13:57:13'),
(203, '697897033', 'Essai verification', NULL, NULL, '2025-07-12 14:27:12', '2025-07-12 14:27:12'),
(204, '675828231', 'CLIENT', NULL, NULL, '2025-07-12 14:27:54', '2025-07-12 14:27:54'),
(205, '678420123', '678420123', NULL, NULL, '2025-07-14 12:20:46', '2025-07-14 12:20:46'),
(206, '697089033', 'MBEINUN VICTOR', NULL, NULL, '2025-07-14 17:34:54', '2025-07-14 17:34:54'),
(207, '697367793', 'NDJOG', NULL, NULL, '2025-07-14 17:56:25', '2025-07-14 17:56:25'),
(208, '699938180', '699938180', NULL, NULL, '2025-07-15 15:26:53', '2025-07-15 15:26:53'),
(209, '672430251', 'Seryabé Salomon', 'Salomon seryabesalomon2@gmail.com', 'Laïndé karéwa village, arrondissement de tcheboa, département de la benoué, région du Nord', '2025-07-16 17:32:08', '2025-07-16 17:32:08'),
(210, '677135717', 'BORIS TECHNICIEN', NULL, NULL, '2025-07-17 11:54:42', '2025-07-17 11:54:42'),
(211, '677135717', 'BORIS TECHNICIEN', NULL, NULL, '2025-07-17 11:56:14', '2025-07-17 11:56:14'),
(212, '699460739', '699460739', NULL, NULL, '2025-07-17 17:22:46', '2025-07-17 17:22:46'),
(213, '681653556', 'Alber', 'nourabbamahammad@gmail.com', 'Extrême nord kousseri afade', '2025-07-17 19:43:25', '2025-07-17 19:43:25'),
(214, '696081494', 'MR MONOBALONGA EMEYENE', NULL, NULL, '2025-07-18 13:44:30', '2025-07-18 13:44:30'),
(215, '694150755', '694150755', NULL, NULL, '2025-07-18 13:57:46', '2025-07-18 13:57:46'),
(216, '694150755', '694150755', NULL, NULL, '2025-07-18 14:22:54', '2025-07-18 14:22:54'),
(217, '675348222', 'Électrotechnicien Bertoua', NULL, NULL, '2025-07-18 19:02:55', '2025-07-18 19:02:55'),
(218, '678976766', 'BIKIM NGUE Anderson', NULL, NULL, '2025-07-19 09:53:28', '2025-07-19 09:53:28'),
(219, '678976766', 'BIKIM NGUE Anderson', NULL, NULL, '2025-07-19 09:55:32', '2025-07-19 09:55:32'),
(220, '678420123', 'EWANE', NULL, NULL, '2025-07-19 11:10:23', '2025-07-19 11:10:23'),
(221, '675348222', 'KOUEDJEU LORIEN DOUGLAS', NULL, NULL, '2025-07-19 19:24:40', '2025-07-19 19:24:40'),
(222, '676977000', 'Younoussa nassourou', 'younoussanassourou773@gmail.com', 'younoussanassourou773@gmail.com', '2025-07-19 20:18:48', '2025-07-19 20:18:48'),
(223, '686191223', '686191223', NULL, NULL, '2025-07-21 09:54:50', '2025-07-21 09:54:50'),
(224, '686191223', '686191223', NULL, NULL, '2025-07-21 10:04:08', '2025-07-21 10:04:08'),
(225, '686191223', '686191223', NULL, NULL, '2025-07-21 10:16:17', '2025-07-21 10:16:17'),
(226, '686191223', '686191223', NULL, NULL, '2025-07-21 10:24:53', '2025-07-21 10:24:53'),
(227, '686191223', '686191223', NULL, NULL, '2025-07-21 10:46:35', '2025-07-21 10:46:35'),
(228, '680176675', '680176675', NULL, NULL, '2025-07-21 11:38:43', '2025-07-21 11:38:43'),
(229, '694150755', '694150755', NULL, NULL, '2025-07-21 12:50:06', '2025-07-21 12:50:06'),
(230, '657392810', 'Mr TICHA', NULL, NULL, '2025-07-21 17:23:31', '2025-07-21 17:23:31'),
(231, '658565965', 'YVES DAWE SOUNGOU', 'yvesdawesoungou1@gmail.com', 'yvesdawesoungou1@gmail.com', '2025-07-21 20:36:00', '2025-07-21 20:36:00'),
(232, '698909731', 'Levis doumi', 'levisdoumi65@gmail.com', 'Kribi', '2025-07-22 03:48:16', '2025-07-22 03:48:16'),
(233, '677600833', 'Sam TAH Christopher', 'Sami nyosboys@gmail.com', 'Pk36 missole', '2025-07-24 05:52:05', '2025-07-24 05:52:05'),
(234, '697462204', 'EBOMBO Guy Félix', NULL, 'Douala pk17', '2025-07-26 20:00:17', '2025-07-26 20:00:17'),
(235, '654105287', '654105287', NULL, NULL, '2025-07-28 17:32:48', '2025-07-28 17:32:48'),
(236, '654105287', '654105287', NULL, NULL, '2025-07-28 18:24:42', '2025-07-28 18:24:42'),
(237, '654105287', '654105287', NULL, NULL, '2025-07-28 18:38:41', '2025-07-28 18:38:41'),
(238, '698181132', 'Aboubakary Abdoulaye', 'aboubakary61@gmail.com', 'Yaoundé Odza', '2025-07-30 05:14:48', '2025-07-30 05:14:48'),
(239, '676949400', 'ARMAND NOTUE', NULL, NULL, '2025-07-31 12:00:54', '2025-07-31 12:00:54'),
(240, '695404961', 'MR WAKAP DONALD', NULL, NULL, '2025-07-31 13:05:04', '2025-07-31 13:05:04'),
(241, '695404961', 'MR WAKAP DONALD', NULL, NULL, '2025-07-31 13:05:07', '2025-07-31 13:05:07'),
(242, '695404961', 'MR WAKAP DONALD', NULL, NULL, '2025-07-31 13:05:08', '2025-07-31 13:05:08'),
(243, '695404961', 'MR WAKAP DONALD', NULL, NULL, '2025-07-31 13:05:08', '2025-07-31 13:05:08'),
(244, '695404961', 'MR WAKAP DONALD', NULL, NULL, '2025-07-31 13:05:09', '2025-07-31 13:05:09'),
(245, '695404961', 'MR WAKAP DONALD', NULL, NULL, '2025-07-31 13:05:09', '2025-07-31 13:05:09'),
(246, '695404961', 'MR WAKAP DONALD', NULL, NULL, '2025-07-31 13:05:10', '2025-07-31 13:05:10'),
(247, '695404961', 'MR WAKAP DONALD', NULL, NULL, '2025-07-31 13:05:10', '2025-07-31 13:05:10'),
(248, '695404961', 'MR WAKAP DONALD', NULL, NULL, '2025-07-31 13:05:10', '2025-07-31 13:05:10'),
(249, '695404961', 'MR WAKAP DONALD', NULL, NULL, '2025-07-31 13:05:10', '2025-07-31 13:05:10'),
(250, '695404961', 'MR WAKAP DONALD', NULL, NULL, '2025-07-31 13:05:15', '2025-07-31 13:05:15'),
(251, '695404961', 'MR WAKAP DONALD', NULL, NULL, '2025-07-31 13:05:16', '2025-07-31 13:05:16'),
(252, '695404961', 'MR WAKAP DONALD', NULL, NULL, '2025-07-31 13:05:16', '2025-07-31 13:05:16'),
(253, '695404961', 'MR WAKAP DONALD', NULL, NULL, '2025-07-31 13:05:24', '2025-07-31 13:05:24'),
(254, '695404961', 'MR WAKAP DONALD', NULL, NULL, '2025-07-31 13:05:25', '2025-07-31 13:05:25'),
(255, '695404961', 'MR WAKAP DONALD', NULL, NULL, '2025-07-31 13:05:25', '2025-07-31 13:05:25'),
(256, '695404961', 'MR WAKAP DONALD', NULL, NULL, '2025-07-31 13:05:25', '2025-07-31 13:05:25'),
(257, '695404961', 'MR WAKAP DONALD', NULL, NULL, '2025-07-31 13:05:26', '2025-07-31 13:05:26'),
(258, '695404961', 'MR WAKAP DONALD', NULL, NULL, '2025-07-31 13:05:26', '2025-07-31 13:05:26'),
(259, '695404961', 'MR WAKAP DONALD', NULL, NULL, '2025-07-31 13:05:26', '2025-07-31 13:05:26'),
(260, '695404961', 'MR WAKAP DONALD', NULL, NULL, '2025-07-31 13:05:29', '2025-07-31 13:05:29'),
(261, '695404961', 'MR WAKAP DONALD', NULL, NULL, '2025-07-31 13:05:30', '2025-07-31 13:05:30'),
(262, '695404961', 'MR WAKAP DONALD', NULL, NULL, '2025-07-31 13:05:30', '2025-07-31 13:05:30'),
(263, '695404961', 'MR WAKAP DONALD', NULL, NULL, '2025-07-31 13:05:31', '2025-07-31 13:05:31'),
(264, '695404961', 'MR WAKAP DONALD', NULL, NULL, '2025-07-31 13:05:31', '2025-07-31 13:05:31'),
(265, '695404961', 'MR WAKAP DONALD', NULL, NULL, '2025-07-31 13:05:31', '2025-07-31 13:05:31'),
(266, '695404961', 'MR WAKAP DONALD', NULL, NULL, '2025-07-31 13:05:31', '2025-07-31 13:05:31'),
(267, '695404961', 'MR WAKAP DONALD', NULL, NULL, '2025-07-31 13:05:32', '2025-07-31 13:05:32'),
(268, '675828231', 'PAULIONEL', NULL, NULL, '2025-07-31 16:23:33', '2025-07-31 16:23:33'),
(269, '695404961', 'MR WAKAP DONALD', NULL, NULL, '2025-08-01 13:06:42', '2025-08-01 13:06:42'),
(270, '695404961', 'MR WAKAP DONALD', NULL, NULL, '2025-08-01 13:06:43', '2025-08-01 13:06:43'),
(271, '695404961', 'MR WAKAP DONALD', NULL, NULL, '2025-08-01 13:06:47', '2025-08-01 13:06:47'),
(272, '695404961', 'MR WAKAP DONALD', NULL, NULL, '2025-08-01 13:06:47', '2025-08-01 13:06:47'),
(273, '695404961', 'MR WAKAP DONALD', NULL, NULL, '2025-08-01 13:06:48', '2025-08-01 13:06:48'),
(274, '695404961', 'MR WAKAP DONALD', NULL, NULL, '2025-08-01 13:06:48', '2025-08-01 13:06:48'),
(275, '698181132', 'ABOUBAKARY', NULL, NULL, '2025-08-02 12:50:26', '2025-08-02 12:50:26'),
(276, '696285340', '696285340', NULL, NULL, '2025-08-02 13:15:55', '2025-08-02 13:15:55'),
(277, '651102661', 'ECRIC NGUETI', 'solutionssolergy@gmail.com', 'BOMONO ', '2025-08-04 09:01:18', '2025-08-04 09:01:18'),
(278, '674239259', 'MR MBOCK SAMUEL', NULL, NULL, '2025-08-04 10:15:15', '2025-08-04 10:15:15'),
(279, '697897033', '697897033', NULL, NULL, '2025-08-07 15:44:33', '2025-08-07 15:44:33'),
(280, '695133177', 'Mme teweche rosine', 'solutionssolergy@gmail.com', '', '2025-08-08 14:04:01', '2025-08-08 14:04:01'),
(281, '695932062', 'PATO', 'solutionssolergy@gmail.com', NULL, '2025-08-08 14:10:41', '2025-08-08 14:10:41'),
(282, '693617921', 'MR NJUWOUYOU ', 'solutionssolergy@gmail.com', 'koutaba', '2025-08-08 14:16:53', '2025-08-08 14:16:53'),
(283, '695655193', 'mr dallas', 'solutionssolergy@gmail.com', 'kouoptamo', '2025-08-08 14:24:04', '2025-08-08 14:24:04'),
